index,id,title,tags,images,gender,product_type,product_type(modified),main_category,sub_category,match_most_similar_>80%_string,match_most_similar_>60%_string,label_1st,label_2nd,label_3rd,buckets_num,buckets,color_num,colors,url,raw_text
352,6816856801362,Quilt Shell / Black Linen Trim,"{Carleen,""Coats + Jackets"",groupbycolor,ss22,Tops}","[{""src"": ""https://cdn.shopify.com/s/files/1/1628/1223/products/F57464AB-AB8B-4C29-AB8B-573253A5A18D_1_105_c.jpg?v=1656439185"", ""position"": 1}, {""src"": ""https://cdn.shopify.com/s/files/1/1628/1223/products/5C52904E-CF9F-44F8-AF2E-49C8E6ECB02C_1_201_a.jpg?v=1656439242"", ""position"": 2}, {""src"": ""https://cdn.shopify.com/s/files/1/1628/1223/products/D9DA73C2-BBDB-42F6-ACB3-22155BBB81C6_1_201_a.jpg?v=1656439266"", ""position"": 3}, {""src"": ""https://cdn.shopify.com/s/files/1/1628/1223/products/8520BE5B-65AD-4113-A49A-E404419F3BC5_1_201_a.jpg?v=1656439309"", ""position"": 4}, {""src"": ""https://cdn.shopify.com/s/files/1/1628/1223/products/FEB8FC32-588D-46EB-9244-5093C1946BA9_1_201_a.jpg?v=1656439339"", ""position"": 5}]",unset,Clothing - coats + jackets - short,coats jackets short,,coats jackets short,,,0,0,0,0,"{Casual,Trendy}",0,{linen},https://shopadhoc.com/products/carleen-quilt-shell-black-linen-trim,"This versatile sleeveless top can be worn by itself or layered over a long sleeve shirt. Each garment is constructed from one of a kind vintage textiles and features black linen trim and tie closures at the back. Details: Vintage textile with 100% linen trim Dry cleaning recommended Made in Los Angeles Nayo is 62, bust 37, waist 31, hips 38, wearing a size M (first three photos) and L (Last three photos) About the brand: With her quirky prints and ultra-wearable styles, Carleen designer Kelsy Parkhouse pretty much had us at hello. Kelsy finds inspiration in her southern California roots. Folk-art motifs, fine art and domestic manufacturing are also mainstays for the emerging designer. After her thesis collection at the Pratt Institute found rave reviews in 2012 and receiving the inaugural Liz Clairborne Concept to Product Award, Kelsy ventured out on her own straight out of school and never looked back."
353,6907923202130,Cloud Top / OOAK Quilt,"{Carleen,groupbycolor,Tops}","[{""src"": ""https://cdn.shopify.com/s/files/1/1628/1223/products/A8E3D959-01B5-4EAA-835B-2944E0145AD8_1_201_a.jpg?v=1656438970"", ""position"": 1}, {""src"": ""https://cdn.shopify.com/s/files/1/1628/1223/products/6E8B03A6-53C7-4CA5-A446-B6BA49D92EF2_1_105_c.jpg?v=1656438970"", ""position"": 2}, {""src"": ""https://cdn.shopify.com/s/files/1/1628/1223/products/E0E66196-5F71-4789-B4B7-ABA79445AB82_1_201_a.jpg?v=1656438970"", ""position"": 3}, {""src"": ""https://cdn.shopify.com/s/files/1/1628/1223/products/01C4B73C-02C5-45F3-A5AD-EA03F7272BCD_1_105_c.jpg?v=1656438970"", ""position"": 4}, {""src"": ""https://cdn.shopify.com/s/files/1/1628/1223/products/9126498C-D632-4D69-964F-87CACC8F5D73_1_105_c.jpg?v=1656438970"", ""position"": 5}, {""src"": ""https://cdn.shopify.com/s/files/1/1628/1223/products/A9C0F128-8E3E-4C14-A89F-D71E2FE4835E_1_105_c.jpg?v=1656438970"", ""position"": 6}]",women,Clothing - tops,tops,tops,,,,2,0,0,0,"{Casual,Trendy}",0,{cloud},https://shopadhoc.com/products/carleen-cloud-top-ooak-quilt,"This playful, cropped top pairs perfectly with high-waisted bottoms. Features elastic at the hem and armholes and a single button closure at the back neck. Made from a vintage quilt top. Runs true to size. Details: Vintage textile with 100% cotton trim Each garment is unique Dry clean recommended Made in Los Angeles Nayo is 62, bust 37, waist 31, hips 38, wearing a size M (first three photos) and L (last three photos) About the brand: With her quirky prints and ultra-wearable styles, Carleen designer Kelsy Parkhouse pretty much had us at hello. Kelsy finds inspiration in her southern California roots. Folk-art motifs, fine art and domestic manufacturing are also mainstays for the emerging designer. After her thesis collection at the Pratt Institute found rave reviews in 2012 and receiving the inaugural Liz Clairborne Concept to Product Award, Kelsy ventured out on her own straight out of school and never looked back."
354,6907327578194,Manon Mini Puff Dress / Harvest Floral,"{""Bronze Age"",canada,canadian,Dress,Dresses,groupbycolor,""party dresses""}","[{""src"": ""https://cdn.shopify.com/s/files/1/1628/1223/products/72BB5BB4-AB8B-44FE-A0ED-D64CE96AC9E9.jpg?v=1656116701"", ""position"": 1}, {""src"": ""https://cdn.shopify.com/s/files/1/1628/1223/products/3CE4750B-6304-42D4-8A20-1B940D2C9BD1.jpg?v=1656116733"", ""position"": 2}, {""src"": ""https://cdn.shopify.com/s/files/1/1628/1223/products/4DD5C807-A440-433C-A4F0-C749EB1E6518.jpg?v=1656116733"", ""position"": 3}, {""src"": ""https://cdn.shopify.com/s/files/1/1628/1223/products/6F87BA0F-7141-4B3E-AD01-FF8EDF0E983C.jpg?v=1656116704"", ""position"": 4}]",women,Clothing - dresses,dresses,,dresses,dress,dress,3,0,0,0,"{Casual,Trendy}",0,{floral},https://shopadhoc.com/products/bronze-age-manon-mini-puff-dress-harvest-floral,"Skip the step where you’re deciding what to wear and go with the Manon Mini Puff. Works. Every. Time. Details: 100% cotton Wash Cold / Hang to dry Fully Lined Bust with invisible side zip Pockets Gabrielle is 55, bust 35, waist 29, hips 36, wearing a size S"
355,6907327610962,Manon Mini Puff Dress / Lime Gingham,"{""Bronze Age"",canada,canadian,Dress,Dresses,groupbycolor,""party dresses""}","[{""src"": ""https://cdn.shopify.com/s/files/1/1628/1223/products/490AF1F8-D457-4EAE-9EDD-B822D4E9FD81.jpg?v=1656116626"", ""position"": 1}, {""src"": ""https://cdn.shopify.com/s/files/1/1628/1223/products/C33D9245-8C44-473C-9350-A6EA049E1542.jpg?v=1656116629"", ""position"": 2}, {""src"": ""https://cdn.shopify.com/s/files/1/1628/1223/products/229D9AAB-CE08-4647-87E7-2FBEDA46B3AB.jpg?v=1656116632"", ""position"": 3}, {""src"": ""https://cdn.shopify.com/s/files/1/1628/1223/products/861EC4C8-E0CD-4921-81FD-DC78B1E35EB2_a75b0afc-728d-4a3d-b108-d9129f2097ba.jpg?v=1656116632"", ""position"": 4}, {""src"": ""https://cdn.shopify.com/s/files/1/1628/1223/products/6140DEC4-0F40-4036-95F3-150400AB72D6.jpg?v=1656116636"", ""position"": 5}, {""src"": ""https://cdn.shopify.com/s/files/1/1628/1223/products/0CDA6ECE-3274-45E9-AF02-314BEF93FEE9_1a6e18ce-dd08-4a81-b78b-d97cc82d74fb.jpg?v=1656116637"", ""position"": 6}]",women,Clothing - dresses,dresses,,dresses,dress,dress,3,0,0,0,"{Casual,Trendy}",0,{gingham},https://shopadhoc.com/products/bronze-age-manon-mini-puff-dress-lime-gingham,"Skip the step where you’re deciding what to wear and go with the Manon Mini Puff. Works. Every. Time. Details: 70% cotton, 30% linen Wash Cold / Hang to dry Fully Lined Bust with invisible side zip Pockets Haley is 52, bust 32, waist 25, hips 35, wearing a size XS"
356,6902769975378,Rope Mini Belt / Natural,"{accessories,Belts,groupbycolor,""Rachel Comey"",rachelcomey}","[{""src"": ""https://cdn.shopify.com/s/files/1/1628/1223/products/CB33EAA7-DF3B-475C-91DE-AE2E9CFA1CE5_1_201_a.jpg?v=1655844977"", ""position"": 1}, {""src"": ""https://cdn.shopify.com/s/files/1/1628/1223/products/A37DCFB2-47D2-4AFF-8524-8F9F2555741B_1_201_a.jpg?v=1655844977"", ""position"": 2}, {""src"": ""https://cdn.shopify.com/s/files/1/1628/1223/products/72A39967-7082-43CB-842B-E6011E9BCC82_1_201_a.jpg?v=1655844990"", ""position"": 3}]",unset,Accessories - Belt,accessories belt,accessories,belt,belt,belt,6,0,0,0,"{Casual,Trendy}",0,{natural},https://shopadhoc.com/products/rachel-comey-rope-mini-belt-natural,"Flat braided cotton rope belt with silver buckle and leather loop and tab. Details: 100% Cotton Made in Peru Jean is 54, size 0, wearing a size S About the brand: Rachel Comey is an American independent fashion designer based in New York City and is the founder of Rachel Comey , her eponymous clothing, shoes, and accessories brand that grew out of the downtown arts scene of early 2000 is New York. A consistent design practice at Rachel Comey is to pose questions: How can fabrics and techniques be engaged to formulate new ways to rethink, change or relate our everyday experiences? In what ways is it possible to affectively(from the philosophical term affect, not a typo for effectively) relate notions of empowerment to the people that wear our clothes? How can we challenge performative notions of what it means to be sexy? How can we look at traditional techniques and craftsmanship from a modern perspective and reinvigorate the artisanal communities that maintain these crafts?"
357,6907327512658,Manon Mini Puff Dress / Highbury,"{""Bronze Age"",canada,canadian,Dress,Dresses,groupbycolor,""party dresses""}","[{""src"": ""https://cdn.shopify.com/s/files/1/1628/1223/products/25EAFD20-DE0D-4BDC-9445-3AE97CFED37F.jpg?v=1656116565"", ""position"": 1}, {""src"": ""https://cdn.shopify.com/s/files/1/1628/1223/products/458455BA-B3DD-4735-8C8C-7B794199639A.jpg?v=1656116586"", ""position"": 2}, {""src"": ""https://cdn.shopify.com/s/files/1/1628/1223/products/06092A5B-5E71-4B8D-995E-EDA4E06B01FF.jpg?v=1656116586"", ""position"": 3}, {""src"": ""https://cdn.shopify.com/s/files/1/1628/1223/products/DFC4BA98-B8F1-4143-AF72-71F019E48EBB.jpg?v=1656116586"", ""position"": 4}]",women,Clothing - dresses,dresses,,dresses,dress,dress,3,0,0,0,"{Casual,Trendy}",0,,https://shopadhoc.com/products/bronze-age-manon-mini-puff-dress-highbury,"Skip the step where you’re deciding what to wear and go with the Manon Mini Puff. Works. Every. Time. Details: 100% cotton Wash Cold / Hang to dry Fully Lined Bust with invisible side zip Pockets Haley is 52, bust 32, waist 25, hips 35, wearing a size XS"
358,6907325710418,Nati Dress / Sky Gingham,"{""Bronze Age"",canada,canadian,Dress,Dresses,groupbycolor,""party dresses""}","[{""src"": ""https://cdn.shopify.com/s/files/1/1628/1223/products/40F3606E-5978-42CB-BFC8-C0ABF96F8C0B.jpg?v=1656116421"", ""position"": 1}, {""src"": ""https://cdn.shopify.com/s/files/1/1628/1223/products/48D511E6-EA7E-431F-B1AC-211B68A9C6E8.jpg?v=1656116422"", ""position"": 2}, {""src"": ""https://cdn.shopify.com/s/files/1/1628/1223/products/C307EEE1-E9B9-4AE2-846A-8F4F48286596.jpg?v=1656116423"", ""position"": 3}, {""src"": ""https://cdn.shopify.com/s/files/1/1628/1223/products/0CDA6ECE-3274-45E9-AF02-314BEF93FEE9.jpg?v=1656116431"", ""position"": 4}, {""src"": ""https://cdn.shopify.com/s/files/1/1628/1223/products/861EC4C8-E0CD-4921-81FD-DC78B1E35EB2.jpg?v=1656116434"", ""position"": 5}]",women,Clothing - dresses,dresses,,dresses,dress,dress,3,0,0,0,"{Casual,Trendy}",0,{gingham},https://shopadhoc.com/products/bronze-age-nati-dress-sky-gingham,"This dress hits just above the knee, with a dramatic lantern sleeve. It’s easy to wear - just throw in on over your head, no buttons or zippers required! Details: 90% cotton, 10% linen Features pockets and a lantern sleeve that hits at the elbow Oversized/Relaxed fit Made in Vancouver, BC Gabrielle is 55, bust 35, waist 29, hips 36, wearing a size S"
359,6650597441618,Nati Dress / Fern Linen,"{""Bronze Age"",Dresses,groupbycolor}","[{""src"": ""https://cdn.shopify.com/s/files/1/1628/1223/products/DSCF6700.jpg?v=1656014189"", ""position"": 1}, {""src"": ""https://cdn.shopify.com/s/files/1/1628/1223/products/DSCF6709.jpg?v=1656014189"", ""position"": 2}, {""src"": ""https://cdn.shopify.com/s/files/1/1628/1223/products/DSCF6702.jpg?v=1626560259"", ""position"": 3}]",women,Clothing - Dress,dress,,dress,dress,dress,3,0,0,0,"{Casual,Trendy}",0,{linen},https://shopadhoc.com/products/bronze-age-nati-dress-fern-linen,"The Nati Dress is a springtime dream! This dress hits just above the knee, with a dramatic lantern sleeve. It’s easy to wear - just throw in on over your head, no buttons or zippers required! Details: 100% Linen Features pockets and a lantern sleeve that hits at the elbow Oversized/Relaxed fit Made in Vancouver, BC Gabrielle is 55, size 4, wearing a size S"
360,6852101767250,Ira Short / Misunderstood,"{AGOLDE,Bottoms,Denim,groupbycolor,jeans,Shorts}","[{""src"": ""https://cdn.shopify.com/s/files/1/1628/1223/products/E9644B61-3C6C-4EEC-A3F8-741861B53427_1_105_c_5043f98b-33f1-4853-9563-fed1b39c93c9.jpg?v=1655941170"", ""position"": 1}, {""src"": ""https://cdn.shopify.com/s/files/1/1628/1223/products/B0833056-7059-4B53-820B-23CEF69E8208_1_105_c.jpg?v=1655941170"", ""position"": 2}, {""src"": ""https://cdn.shopify.com/s/files/1/1628/1223/products/900E0935-ABC4-4BAF-8A80-FAF5A6DC3604_1_201_a.jpg?v=1655941170"", ""position"": 3}]",unset,Clothing - bottoms - denim,bottoms denim,bottoms,denim,,,3,0,0,0,"{Casual,Trendy}",0,,https://shopadhoc.com/products/agolde-ira-short-misunderstood,"High waisted vintage-style cutoff short with a raw hem and above-the-knee length. Made with sturdy non-stretch denim in organic cotton. Details: 100% organic cotton Made in Turkey Julia is 58, size 4, wearing a size 28 About the brand: AGOLDE is a premium denim label dedicated to setting the standard for advanced, directional denim. Continually seeking inspiration from the classics, their Los Angeles based design collective sets out to recreate them with a fresh reinterpretation in mind. An AGOLDE silhouette offers the authenticity and rarity found in discovering the perfect vintage pair. As we continue to aspire and push boundaries, we draw influence from many directions of today’s emerging artists and creatives."
361,6852111073362,Parker Long / Wheel,"{agolde,Bottoms,denim,groupbycolor,jeans,Shorts,usa}","[{""src"": ""https://cdn.shopify.com/s/files/1/1628/1223/products/A3BD0AB6-99C6-45BA-AA9A-C59BFE1AFBDB_1_105_c.jpg?v=1655940654"", ""position"": 1}, {""src"": ""https://cdn.shopify.com/s/files/1/1628/1223/products/392C1E27-0B9F-4E77-8F75-A91E8CE2F9E9_1_105_c_668c0f88-359e-46f6-a18f-6b3fb7a8348a.jpg?v=1655940655"", ""position"": 2}, {""src"": ""https://cdn.shopify.com/s/files/1/1628/1223/products/1AC3743C-9107-4978-BDE4-53421DAF75D9_1_201_a.jpg?v=1655940703"", ""position"": 3}]",unset,Clothing - bottoms - denim,bottoms denim,bottoms,denim,,,3,0,0,0,"{Casual,Trendy}",0,,https://shopadhoc.com/products/agolde-parker-long-wheel,"Relaxed vintage-style cutoff short with mid rise and raw hem. Slightly longer than the classic parker short, this version offers more coverage. Made with sturdy non-stretch denim in organic cotton. Details: 100% organic cotton Made in USA Kelly is 52, bust 35, waist 27, hips 37, wearing a size 25 About the brand: AGOLDE is a premium denim label dedicated to setting the standard for advanced, directional denim. Continually seeking inspiration from the classics, their Los Angeles based design collective sets out to recreate them with a fresh reinterpretation in mind. An AGOLDE silhouette offers the authenticity and rarity found in discovering the perfect vintage pair. As we continue to aspire and push boundaries, we draw influence from many directions of today’s emerging artists and creatives."
362,6852111302738,Parker / Curse,"{agolde,Bottoms,denim,groupbycolor,jeans,Shorts,usa}","[{""src"": ""https://cdn.shopify.com/s/files/1/1628/1223/products/AE663B07-2DCA-4043-9895-13750A02E6BE_1_105_c_29dbc15a-6035-4930-8b57-d6549c726eb0.jpg?v=1655940156"", ""position"": 1}, {""src"": ""https://cdn.shopify.com/s/files/1/1628/1223/products/F6EACA45-E0C0-46FB-B0A8-12CE15F7CD4B_1_105_c.jpg?v=1655940159"", ""position"": 2}, {""src"": ""https://cdn.shopify.com/s/files/1/1628/1223/products/CB513EB0-BB82-4A7C-B640-4EB97949F59B_1_105_c_65cc1246-bb59-47d5-9c57-9f1d32c09edd.jpg?v=1655940162"", ""position"": 3}]",unset,Clothing - bottoms - denim,bottoms denim,bottoms,denim,,,3,0,0,0,"{Casual,Trendy}",0,,https://shopadhoc.com/products/agolde-parker-curse,"Relaxed vintage-style cutoff short with mid rise and raw hem. Made with sturdy non-stretch denim in organic cotton. Details: 100% organic cotton Made in USA Julia is 58, size 4, wearing size 28 About the brand: AGOLDE is a premium denim label dedicated to setting the standard for advanced, directional denim. Continually seeking inspiration from the classics, their Los Angeles based design collective sets out to recreate them with a fresh reinterpretation in mind. An AGOLDE silhouette offers the authenticity and rarity found in discovering the perfect vintage pair. As we continue to aspire and push boundaries, we draw influence from many directions of today’s emerging artists and creatives."
363,6906755448914,Stella Short / Risk,"{AGOLDE,Bottoms,groupbycolor,jeans,Shorts}","[{""src"": ""https://cdn.shopify.com/s/files/1/1628/1223/products/78E25E69-D816-4847-BB88-B0F436210686.jpg?v=1655939529"", ""position"": 1}, {""src"": ""https://cdn.shopify.com/s/files/1/1628/1223/products/CEC27954-ACAA-49C3-804E-6A74EA967FA2.jpg?v=1655939529"", ""position"": 2}]",unset,Clothing - bottoms - denim,bottoms denim,bottoms,denim,,,3,0,0,0,"{Casual,Trendy}",0,,https://shopadhoc.com/products/agolde-stella-short-risk,"Clean, white high-rise short with a cinched waist and relaxed silhouette. Designed with an angled raw hem for an ultra-flattering fit. Details: 100% cotton Made in USA Gabrielle is 55, bust 35, waist 29, hips 36, wearing a size 27 About the brand: AGOLDE is a premium denim label dedicated to setting the standard for advanced, directional denim. Continually seeking inspiration from the classics, their Los Angeles based design collective sets out to recreate them with a fresh reinterpretation in mind. An AGOLDE silhouette offers the authenticity and rarity found in discovering the perfect vintage pair. As we continue to aspire and push boundaries, we draw influence from many directions of today’s emerging artists and creatives."
364,6906760462418,Amara Crewneck Tee / Nocturne,"{AGOLDE,groupbycolor,tanks,tee,Tees,top,Tops}","[{""src"": ""https://cdn.shopify.com/s/files/1/1628/1223/products/F6EACA45-E0C0-46FB-B0A8-12CE15F7CD4B_1_201_a.jpg?v=1655938724"", ""position"": 1}, {""src"": ""https://cdn.shopify.com/s/files/1/1628/1223/products/CB513EB0-BB82-4A7C-B640-4EB97949F59B_1_105_c.jpg?v=1655938820"", ""position"": 2}, {""src"": ""https://cdn.shopify.com/s/files/1/1628/1223/products/AE663B07-2DCA-4043-9895-13750A02E6BE_1_105_c.jpg?v=1655939193"", ""position"": 3}]",unset,Clothing - tops - casual,tops,tops,,,,2,0,0,0,"{Casual,Trendy}",0,,https://shopadhoc.com/products/agolde-amara-crewneck-tee-nocturne,"Classic sleeveless muscle tee with a high crew neckline, relaxed fit, and ultra soft construction. Details: 100% cotton Made in USA Julia is 58, size 4, wearing size 28 About the brand: AGOLDE is a premium denim label dedicated to setting the standard for advanced, directional denim. Continually seeking inspiration from the classics, their Los Angeles based design collective sets out to recreate them with a fresh reinterpretation in mind. An AGOLDE silhouette offers the authenticity and rarity found in discovering the perfect vintage pair. As we continue to aspire and push boundaries, we draw influence from many directions of today’s emerging artists and creatives."
365,6846694752338,Elle Short / Lemon,"{""Atelier Delphine"",groupbycolor,Shorts,usa}","[{""src"": ""https://cdn.shopify.com/s/files/1/1628/1223/products/B0A7178D-A38D-4FD4-9ACA-7E7A7FB17D86.jpg?v=1649203575"", ""position"": 1}, {""src"": ""https://cdn.shopify.com/s/files/1/1628/1223/products/87905667-20AD-43BD-BB25-EEA3107377BB.jpg?v=1649203578"", ""position"": 2}, {""src"": ""https://cdn.shopify.com/s/files/1/1628/1223/products/D96A8B1D-8D32-4DE7-80E4-80493A6D27A0.jpg?v=1649203580"", ""position"": 3}]",unset,Clothing - Bottoms,bottoms,bottoms,,,,3,0,0,0,"{Casual,Trendy}",0,{lemon},https://shopadhoc.com/products/atelier-delphine-elle-short-lemon,"Double-layer gauze knee length shorts with a high waist, back pockets and side seam pockets. Details: Made in USA Lola is 57, bust: 34 waist: 26 hips: 35 wearing a size XS"
366,6571571380306,Elle Short / Dark Indigo,"{""Atelier Delphine"",Bottoms,groupbycolor,usa}","[{""src"": ""https://cdn.shopify.com/s/files/1/1628/1223/products/F1DCEE70-63A3-4D53-85E4-C0ABDD6CFBBA.jpg?v=1649203702"", ""position"": 1}, {""src"": ""https://cdn.shopify.com/s/files/1/1628/1223/products/D33BD62D-5795-47FA-B9BD-0E97A490CC55.jpg?v=1649203702"", ""position"": 2}, {""src"": ""https://cdn.shopify.com/s/files/1/1628/1223/products/A1FE0302-39D1-45C8-940A-F87CCD2A2619.jpg?v=1649203702"", ""position"": 3}, {""src"": ""https://cdn.shopify.com/s/files/1/1628/1223/products/393D95DC-2894-4121-AFE4-40328FBBA2B1.jpg?v=1649203702"", ""position"": 4}, {""src"": ""https://cdn.shopify.com/s/files/1/1628/1223/products/77F4FA9F-5FDB-4A53-A709-07705D801ABD.jpg?v=1649203702"", ""position"": 5}, {""src"": ""https://cdn.shopify.com/s/files/1/1628/1223/products/716D3BC1-AFD4-47AA-920F-DA0E3213314E.jpg?v=1649203702"", ""position"": 6}, {""src"": ""https://cdn.shopify.com/s/files/1/1628/1223/products/83BBED6B-A324-4984-B522-8FB4414704F1.jpg?v=1649203702"", ""position"": 7}]",unset,Clothing - Bottoms,bottoms,bottoms,,,,3,0,0,0,"{Casual,Trendy}",0,{indigo},https://shopadhoc.com/products/atelier-delphine-elle-short-dark-indigo,"Unisex relaxed wide shorts. Boxy relaxed fit with elasticated waist. Sigle side-entry chest pocket, 2 patch hip pockets at back. Double layered heavyweight gauze dyed with indigo. Details: 100% Cotton imported from Japan Made in USA Machine wash / Hand wash / Tumble dry low / Wash with like colours Gabrielle is 55, bust 35, waist 29, hips 36, wearing a size XS Nykita is 57, size 2/4, wearing a size XS"
367,6571571314770,Elle Short / Hunter Green,"{""Atelier Delphine"",Bottoms,groupbycolor,usa}","[{""src"": ""https://cdn.shopify.com/s/files/1/1628/1223/products/A8BA1EB3-18B7-4658-86F3-573A5EF3F5F9.jpg?v=1619216804"", ""position"": 1}, {""src"": ""https://cdn.shopify.com/s/files/1/1628/1223/products/921748DC-0254-48E9-9327-A2C59D2E7BD9.jpg?v=1619216804"", ""position"": 2}, {""src"": ""https://cdn.shopify.com/s/files/1/1628/1223/products/D5425FC4-9DBE-4583-A30B-83B93A908580.jpg?v=1619216804"", ""position"": 3}, {""src"": ""https://cdn.shopify.com/s/files/1/1628/1223/products/7F8475BB-F284-4B2C-A166-6412BF291E6D.jpg?v=1619216804"", ""position"": 4}, {""src"": ""https://cdn.shopify.com/s/files/1/1628/1223/products/BDDBEC11-FCD7-4780-9A9B-1184DA40669A.jpg?v=1619216804"", ""position"": 5}]",unset,Clothing - Bottoms,bottoms,bottoms,,,,3,0,0,0,"{Casual,Trendy}",0,{green},https://shopadhoc.com/products/atelier-delphine-elle-short-hunter-green,"Unisex relaxed wide shorts. Boxy relaxed fit with elasticated waist. Sigle side-entry chest pocket, 2 patch hip pockets at back. Double layered heavyweight gauze dyed with indigo. Details: 100% Cotton imported from Japan Made in USA Machine wash / Hand wash / Tumble dry low / Wash with like colours Nykita is 57, size 2/4, wearing a size XS"
368,6901255241810,Waxed Canvas Tote / Brown,"{bag,Bags,canada,canadian,groupbycolor,""Small Lot""}","[{""src"": ""https://cdn.shopify.com/s/files/1/1628/1223/products/F1844D6B-D3F0-442C-BCC4-E611938D07F1_1_105_c.jpg?v=1655938217"", ""position"": 1}, {""src"": ""https://cdn.shopify.com/s/files/1/1628/1223/products/C4DC4216-F233-44EE-9763-B1EBE9D6F527_1_201_a.jpg?v=1655938226"", ""position"": 2}]",unset,Accessories - Bag,accessories bag,accessories,bag,bag,bag,6,0,0,0,"{Casual,Trendy}",0,{brown},https://shopadhoc.com/products/small-lot-waxed-canvas-tote-brown,"This 10oz waxed cotton canvas tote is structured, durable, and water repellent. Fitted with 2 wide straps, a reinforced bottom, and an interior pocket to hold your phone and keys. Measurements: 18 length 16 height 7.5 width. Strap height 9.5 100% cotton canvas Environmentally friendly wax Measurements: 18 length 16 height 7.5 width. Strap height 9.5 Made in Vancouver, BC"
369,6901255274578,Waxed Canvas Tote / Sage,"{accessories,bag,Bags,canada,canadian,groupbycolor,""Small Lot""}","[{""src"": ""https://cdn.shopify.com/s/files/1/1628/1223/products/D33029A2-F7B4-4F76-BE0B-C00A22DFCCB2_1_105_c.jpg?v=1655937771"", ""position"": 1}, {""src"": ""https://cdn.shopify.com/s/files/1/1628/1223/products/392C1E27-0B9F-4E77-8F75-A91E8CE2F9E9_1_105_c.jpg?v=1655937825"", ""position"": 2}, {""src"": ""https://cdn.shopify.com/s/files/1/1628/1223/products/CFF5F079-505F-4787-A995-9E45A1F2A874_1_201_a.jpg?v=1655937912"", ""position"": 3}]",unset,Accessories - Bag,accessories bag,accessories,bag,bag,bag,6,0,0,0,"{Casual,Trendy}",0,{sage},https://shopadhoc.com/products/small-lot-waxed-canvas-tote-sage,"This 10oz waxed cotton canvas tote is structured, durable, and water repellent. Fitted with 2 wide straps, a reinforced bottom, and an interior pocket to hold your phone and keys. Measurements: 18 length 16 height 7.5 width. Strap height 9.5 100% cotton canvas Environmentally friendly wax Measurements: 18 length 16 height 7.5 width. Strap height 9.5 Made in Vancouver, BC"
370,6679443079367,Body glove crop Ladies ribbed top,{top},"[{""src"": ""https://cdn.shopify.com/s/files/1/0535/8043/1559/products/image_c767c37f-93bd-4a3c-8f62-1b02e59f8411.jpg?v=1626994066"", ""position"": 1}, {""src"": ""https://cdn.shopify.com/s/files/1/0535/8043/1559/products/image_b336190e-f1b7-42c9-8c45-b41ba098254a.jpg?v=1649542805"", ""position"": 2}, {""src"": ""https://cdn.shopify.com/s/files/1/0535/8043/1559/products/image_5e34e9b6-7618-459a-95b7-6e6a2e34f050.jpg?v=1651775021"", ""position"": 3}]",women,Ladies swimwear,swimwear,,swimwear,swimwear,swimwear,4,0,0,0,"{Casual,Swimwear}",0,"{White,Spice,Black}",https://cruzwear.com/products/ladies-swimwear-24,Body Glove Norah top Ibiza
