,title,product_type,tags,body_html
50,"Shirley Blouse, Indigo/Grey Leaves",blouse,"{""3/4 Sleeve"",50%,""Batik Art"",Blouse,fw2019,Navy,Nyoman,Rayon,sale,Viscose}","DescriptionThe Shirley is generous in shape and a wonderful base for our beautiful Batik Art prints.A flat, front pleat gives extra room near the waist and allows seams to be straighter, for a more narrow-looking shape. 3/4 length sleeves are loose but still slim. A slight Mandarin collar adds a touch of elegance. The Shirley falls right around the hip, making it easy to wear with many different pant styles.Features- Slight Mandarin collar- V-neckline- 3/4 length sleeves- Front pleatBlue Sky fit guide - true to size.Fabric - 100% plant-based, wrinkle-resistant Rayon<!--.tb_button {padding:1px;cursor:pointer;border-right: 1px solid #8b8b8b;border-left: 1px solid #FFF;border-bottom: 1px solid #fff;}.tb_button.hover {borer:2px outset #def; background-color: #f8f8f8 !important;}.ws_toolbar {z-index:100000} .ws_toolbar .ws_tb_btn {cursor:pointer;border:1px solid #555;padding:3px}   .tb_highlight{background-color:yellow} .tb_hide {visibility:hidden} .ws_toolbar img {padding:2px;margin:0px}-->"
51,Long Sleeve Tee - Bamboo Jersey / Cochlea,tops,"{Baserange,groupbycolor,Tops}","Long-sleeve crewneck tee made of soft and subtly sheer bamboo jersey. Perfect for layering or as an elevated basic tee.Details:100% bambooMade in PortugalLiza is 5'9'', size 6, wearing a size S"
52,"Mia Top, Indigo Roses, Bamboo",top,"{""3/4 Sleeve"",Bamboo,""Blue Zone"",fw2021,Marie,Navy,regular,Sunny,Top}","DescriptionFlattering whether worn loose or body-con. The Mia Top is made of stretchy Bamboo, and has two layers in the front for added structured. Bamboo is cool, so this double layer remains a comfortable option. A soft V-neckline suggests a vertical axis, and aligns with tapered shape down the body. T-shirt simplicity with a very shapely fit, the Mia a great choice for pairing with a variety of different pants and skirts.Features- Soft V-neckline- 3/4 length sleeves- Two layers in the front- Tapered shape down the bodyBlue Sky fit guide - true to size for a body-con fit, or go up one size for a slightly relaxed fit.Fabric - 95% Bamboo, 5% LycraHelen and Karen are both 5'8"" and they wear size XS.Length Measurements, Top of Shoulder to Bottom of Hemline (cm)XXSXSSMLXL1X2X3X4X60626466687072757881<!--.tb_button {padding:1px;cursor:pointer;border-right: 1px solid #8b8b8b;border-left: 1px solid #FFF;border-bottom: 1px solid #fff;}.tb_button.hover {borer:2px outset #def; background-color: #f8f8f8 !important;}.ws_toolbar {z-index:100000} .ws_toolbar .ws_tb_btn {cursor:pointer;border:1px solid #555;padding:3px}   .tb_highlight{background-color:yellow} .tb_hide {visibility:hidden} .ws_toolbar img {padding:2px;margin:0px}--><!--.tb_button {padding:1px;cursor:pointer;border-right: 1px solid #8b8b8b;border-left: 1px solid #FFF;border-bottom: 1px solid #fff;}.tb_button.hover {borer:2px outset #def; background-color: #f8f8f8 !important;}.ws_toolbar {z-index:100000} .ws_toolbar .ws_tb_btn {cursor:pointer;border:1px solid #555;padding:3px}   .tb_highlight{background-color:yellow} .tb_hide {visibility:hidden} .ws_toolbar img {padding:2px;margin:0px}--><!--.tb_button {padding:1px;cursor:pointer;border-right: 1px solid #8b8b8b;border-left: 1px solid #FFF;border-bottom: 1px solid #fff;}.tb_button.hover {borer:2px outset #def; background-color: #f8f8f8 !important;}.ws_toolbar {z-index:100000} .ws_toolbar .ws_tb_btn {cursor:pointer;border:1px solid #555;padding:3px}   .tb_highlight{background-color:yellow} .tb_hide {visibility:hidden} .ws_toolbar img {padding:2px;margin:0px}-->"
53,Cropped Tank / Cobalt Blue,tops,"{groupbycolor,Jungmaven,Tops}","""A summer staple; perfect for high-waisted bottoms and good times all around.""Details:55 Hemp/45 Organic CottonMade in USAAilie is 5'8, size 4, wearing a size M"
54,Coolibar Women's Arabella Quarter-Zip UPF 50+,shirts,"{Jackets,Sports,Tops,Women}","The Arabella Quarter-Zip features the beautiful, light jacquard knit diamond texture of the Active Diamond™ fabric. The soft detailing of the stitching amplifies the flattering ruching on the shoulders and along the zipper of this fitness quarter-zip. The UPF 50+ coverage extends even further with the stand-up collar and unique hem that curves perfectly along the top of the hand.Highlights:UPF 50+Slightly fittedStand collar with quarter-zipRaglan full-length sleeves with thumbholesSlightly curved hemRuching detail on raglan seamsBeautiful jacquard diamond texture26 ½” Body length (size medium)Active Diamond™ fabric: Ultra-soft, lightweight, breathable, quick dry performanceNylon/Spandex BlendMachine wash, tumble dryActive Diamond™ FabricActive Diamond fabric has a jacquard knit construction with a subtle raised pattern that accelerates moisture wicking for fast quick-dry performance. It’s soft and silky, lightweight and breathable, perfect for a workout and on the court or course."
55,Dydine Top / Occular,tops,"{Baserange,groupbycolor,Tops}","Sheer linen bias cut tank top with thin adjustable straps. Made of light and breezy linen.Details:100% linenMade in TurkeyNicolette is wearing a size S About the brand:Founded in 2012, Baserange is a line of modern basics with an emphasis on clean lines and easy silhouettes. The company works closely with innovative vendors to develop high quality textiles from both natural fibers and recycled content. Baserange believes that a commitment to clean production will minimize environmental impact and benefit both the producer and the user."
56,"Gemi Top, Red Plaid, Bamboo",top,{},"Flattering notched detail at neckline. Flat pleat CB for easy clearance across the back. In addition, a slightly wider back panel controls fabric fall, for a trimly finished front and generous finish at back. Touch of A-line, small vents. Falls to low hip.Blue Sky fit guide - true to size; great fit for all shapes, but exceptionally easy to wear for women who are wide in the back and/or full in the bust. (4C5)Fabric - 95% bamboo, 5% Lycra"
57,Under Armour Men's Sportstyle Terry Hoodie American Blue,hoodie,"{hoodie,mens,sportswear,tops,""under armour""}","1329291-449Product DNALoose: Fuller cut for complete comfort.French Terry has a smooth outer layer &amp; a warm, soft inner layerMaterial wicks sweat &amp; dries really fastCrossover hood construction with drawcord adjustFront kangaroo pocketSide-vent hemEmbroidered logo80% Cotton/20% Polyester"
58,SPACE GANJA LONG SLEEVE T,long sleeve t,"{Galaxy,Narcotics,Nu,Psychedelic,Space}","Vibrant all over front &amp; back design100% premium soft-spun polyesterPrint will never fade, crack or wrinkleHandmade with love in North America, just for you!Ships out in 7 - 10 business days."
59,THE ALMIGHTY HOODIE,premium hoodie,"{Nu,Psychedelic}","Vibrant all over front &amp; back design100% premium soft-spun polyesterPrint will never fade, crack or wrinkleHandmade with love in the USA, just for you!Ships out in 7 - 10 business days."
60,Bamboo Long Sleeve Top,top,"{""CEST MOI"",""Mother's Day"",ONG,""Regular Price"",T-shirt,TOP}","Style # CEBT1202 – 03/CM01This stylish long sleeve top adds a trendy look to any outfit. The bamboo-blend fabric offers a seamless look, is super stretchy and it will not pill. It’s the perfect layering piece!Style: TopFit: Fitted with stretchLength: Hip but can be stretched longerSizing: One Size fits sizes 2-12SeamlessScoop necklineLong sleevesCold water wash on gentle cycleComposition: 80% Rayon from Bamboo, 17% Nylon, 3% Spandex"
61,Camp Fit Ciao Tee / Blue,tops,"{""Clare V."",Tops}","Extra soft and boxy camp tee with bold ""ciao"" print. Anna is 5'8 wearing a size smallGabrielle is 5'5 wearing a size smallDetails:100% cottonPre-shrunkMade in Los Angeles, California About the brand:After noticing a lack of functional yet stylish laptop cases while working as a journalist for French TV, Clare decided to create her own line of handbags and accessories. Over time, Clare’s been able to cultivate an identifiable aesthetic that's all her own and has been recognized worldwide by influencers, tastemakers, celebrities and bloggers, who support and wear the line. Clare’s strong connection to France, where she spends a significant amount of time each year with her French husband and son, remains at the core of the brand, with signature elements visible within every collection."
62,PSYCHEDELIC FELIX HOODIE,premium hoodie,"{Nu,Psychedelic}","Vibrant all over front &amp; back design100% premium soft-spun polyesterPrint will never fade, crack or wrinkleHandmade with love in North America, just for you!Ships out in 7 - 10 business days."
63,QUESTION EVERYTHING GRAPHIC LONG SLEEVE T,long sleeve t,"{Dark,Nu,Psychedelic}","PREMIUM SOFT DTG PRINT,MADE TO ORDER IN 2-4 DAYS.  • 100% cotton • Pre-shrunk jersey knit Size guide SMLXL2XL3XL4XL5XLLength (inches)2829303132333435Width (inches)1820222426283032"
64,DEEP BLUE SPACE T,premium tee,"{Galaxy,Nu,Space}","Vibrant all over front &amp; back design100% premium soft-spun polyesterPrint will never fade, crack or wrinkleHandmade with love in North America, just for you!Ships out in 7 - 10 business days."
65,"Hourglass Blouse, Grey Aridot, Batik Art",blouse,"{20,""Batik Art"",Blouse,Grey,Lynn,sale}","A V-neckline draws attention up and center, then is lengthened by a button placket down the front. This arrow shape suggests symmetry and height. The hemline is longer on the sides, where there is added fluidity. Sleeves float from the clearly-defined shoulder and mirror the movement of hemlines.Blue Sky fit guide - true to size. The Hourglass fits all shapes, but is especially great for those who are shorter and fuller.Fabric - 100% plant-based, wrinkle-resistant rayon "
66,Amuse Society A La Page Graphic Tee,tops,{},Oversized boyfriend tee with a fun beachy graphic. Throw it on over your ‘kini and cutoffs this summer! A soft tee you’ll be reaching for on the daily. 100% COTTON
67,Group Think 1 Tank,tank,"{Dolcezza,""Group Think 1"",RESORT,Tank}","Style # 21630 – 03/0755Take on the season with style!This lightweight viscose-blend top features a fun art-inspired print, a round neckline and sleeveless style. We love to style this blouse with light coloured ankle pants and a denim jacket for an edgy and on-trend outfit.Style: TankFit: StandardLength: HipRound necklineSleevelessHand wash separately in cold waterComposition: 96% Viscose, 4% Elastane"
68,Capri Top / Lavender,tops,"{""Atelier Delphine"",groupbycolor,""Knit Top"",top,Tops}","Hand-knit sleeveless top with a cropped fit and cutout details on one side.Details:ReversibleMade in PeruDry clean only Lola is 5'7"", bust: 34"" waist: 26"" hips: 35"" wearing a size XS/S"
69,Top - Dex Smocked Square Neck Blouse,womens top,"{1924024,27Jan22,blouse,blue,cream,dex,dot,neck,""new arrival"",sky,smocked,square,top,womens}",Dex smocked square neck blouseCotton slub
70,EXOTIC MOON HOODIE,premium hoodie,"{Galaxy,Nu,Psychedelic}","Vibrant all over front &amp; back design100% premium soft-spun polyesterPrint will never fade, crack or wrinkleHandmade with love in North America, just for you!Ships out in 7 - 10 business days."
71,"Jazz Tank, Deep Orchid, Bamboo",tank,"{Bamboo,fw2021,Marie,""Orchid Zone"",Purple,regular,Sleeveless,Sunny,Tank,Top}","DescriptionOur best-selling tank, the Jazz provides comfort through it's design and our soft, Bamboo fabric.The fuller shape of the Jazz Tank is both forgiving and style-ready. Designed so that fabric floats away from the body, creating a softened visual effect and clean finish. A longer hemline in the back provides coverage, and shoulder straps are carefully shaped to hide bras.Features- U-neckline- Wide shoulder straps- A-line shape- Shirt-tail hemlineBlue Sky fit guide - generousFabric - 95% Bamboo, 5% LycraLength Measurements, Top of Shoulder to Bottom of Hemline (cm)XXSXSSMLXL1X2X3X4X65676971737577808284"
72,"Ladysmith Jacket, Black, Wool",sweater,"{50%,Black,""Charcoal Zone"",Cotton,fw2021,sale,Sweater,Tony,Wool}","Description The Ladysmith Jacket brings the softness of a sweater, with the structure and warmth of a jacket.  The Ladysmith has a straight body shape and front button closure. Two front patch pockets are roomy and perfect for your phone, keys, or wallet. Wear the Ladysmith Jacket over your favourite long sleeve or turtleneck.Features- Long sleeves- Button-up front closure- Deep, front pocketsBlue Sky fit guide - true to size.Fabric - 70% Cotton, 30% Wool"
73,CAIRO LEATHER JACKET  - CHESTNUT,leather jacket,"{""blazers jackets coats"",chestnut,fw21,gastown,mauritius,mens,sheepskin}","This classic Mens' Lambskin jacket in Chestnut.All the skins used are vegetable tanned sheepskin.All body linings are natural cotton, a breathable fiber, and the sleeve pipes lined with satiny polyester for ease of movement.Linings are embellished with good advice, discreetly tone on tone. ( Smile often/ Laugh loudly, for example )  All exterior pockets are leather taped inside, to reveal leather rather than lining fabric when open. Interior pockets have secure zipper closures.Color details are often employed under the collar or in the gore of a zip cuff for accent.Zippers and zipper pulls have been thought out to coordinate with the color and ‘feel’ of each style."
74,Coolibar Women's Catalina Beach Cover-Up Dress UPF 50+,shirts,"{Hoodies,Shirts,summer,Swim,Tops,Women}","Everything about the lightweight Catalina Beach Cover-Up Dress is relaxed and casual. Loose front pockets, a deep V-neck, a hood with a drawcord all combine to say: let’s go to the beach! ZnO fabric features zinc oxide particles embedded into the fibers. Sun protection that won't wash or wear out!!Highlights:UPF 50+Hooded v-neckline with drawcordLoose pocketsSide seam vents35"" body length (size medium) falls to mid-thighCotton/Viscose from Bamboo/Elastane blendZnO™ FabricSuper soft against the skin, lightweight, cool and comfortable with the highest quality zinc oxide protection"
75,"Terri Jacket, Black Granite",jacket,"{Black,carryover,fw2019,fw2021,Grey,""Grey Zone"",Jacket,""Long Sleeve"",Rayon,regular,Viscose}","Layering jacket in soft bamboo fleece.Tapering at the high waist gives shape, repeated by colour-blocking. Flat-locked seams are hardy, while the high neck, long sleeve, and slightly longer hemline offer full-coverage warmth. The Terri jacket looks tailored, but is essentially a casual jacket - with great shape and style. Light but warm bamboo fleece is soft and breathable. (4N1,2)Blue Sky fit guide - true to size, with a sweater beneath. Go down a size for a fitted look.Fabric - 67% Bamboo, 28% Cotton, 5% Lycra"
76,Talia Tie Back Tank,tops,{},"Tank top featuring a fun tie-back design. Dress this piece up with some high-rise denim, a heeled sandal, and some simple jewels! Perfect for patio season. Comes in so many fun colours from bright and bold options to simple neutrals. "
77,PSYTRANCE SLEEVELESS HOODIE,premium sleeveless hoodie,"{Nu,Psychedelic,""Sacred Geometry""}","Vibrant all over front, back &amp; hood design100% premium soft-spun polyResistant to wrinkles, shrinking, abrasion and mildewPrint will never fadeHandmade with love in North America, just for you!Ships out in 7 - 10 business days."
78,Aires Top / Camel,tops,"{groupbycolor,""Knit Top"",Knitwear,""Rachel Comey"",Tops}","Sleeveless crop top in a breezy linen knit. Designed with adjustable side ties at the waist.Details:100% linenMade in China Gabrielle is 5'5"", bust 35"", waist 29"", hips 36"", wearing a size SStyled with Rachel Comey Coxsone pant."
79,"Relaxed Tank, Indigo, Bamboo",tank,"{Bamboo,basic,basic2022,Navy,regular,Sunny,Tank}","DescriptionThe Relaxed is an easy-fit tank that can transition from the gym to a night out. Our Bamboo fabric makes it breathable and stretchy, resulting in ultimate comfort for the body. Arm holes fit snugly to prevent gaping, and the shape is a subtle A-line that ends in a straight hemline at the hip. Features- Scoop neck- Falls to the hip- Straight hemlineBlue Sky fit guide - true to size.Fabric - 50% Bamboo, 42% Modal, 8% LycraModel is 5' 6"" and wears size S.Length Measurements, Top of Shoulder to Bottom of Hemline (cm)XXSXSSMLXL1X2X3X4X66687072757881848790"
80,Top - Z Supply Maya Long Quilted Jacket,womens top,"{14Jan22,jacket,long,maya,""new arrival"",onyx,quilted,supply,top,womens,z}","Z Supply Maya long quilted jacketZ Supply's popular Maya Quilted Jacket gets another epic update with the Maya Long Quilted Jacket. Featuring the same great quilted design, this new version is longer and so flattering with a zippered front, perfect for those chilly days.FABRICCVC Fleece: 60% Cotton 40% PolyesterFITOversized Fit.  "
81,Cally Tee,tops,"{_tab1_free-people-sizing,_tab2_atb-free-people,_tab3_care-free-people,blouse,clothing,free-people,green,sale,tops}","An effortless essential from the We the Free collection, this timeless tee is featured in a boxy, cropped silhouette and super relaxed fit with raw bottom hem for a lived-in look.Machine Wash Cold100% CottonFit Guide:Oversized Fit"
82,Catalina Tunic - NEW ARRIVAL,top,"{""COTTON COUNTRY"",""Regular Price"",S22,TOP}","STYLE # 80081 - 08/0959This cute knit sweater is sure to make a statement this spring and summer.  It has a split-hem detail, 3/4 length sleeves with colourful thick stripes, and a boat neckline.Style: PulloverFit: RelaxedLength: Below hipsBoat neckline3/4 length sleeves with colourful stripes at the cuffSplit at hemKnit fabricMachine was in cold waterComposition: 100% CottonMade with earth friendly recycled cotton is a water reducing technology producing sustainable fabric. Only 8.8 water bottles were used per garment. Proudly made in Canada."
83,"Ritzy Tank, Realistic Love, Bamboo",tank,"{Bamboo,Print2022,regular,ss2022,Sunny,Tank,Teal,""Teal Zone""}","DescriptionThe Ritzy Tank features a sweetheart neckline that flatters on all. Wide shoulder straps hide bras, and a touch of shaping at the high waist adds light definition, conforming to your natural shape. Cut to the mid-hip, the Ritzy has a fluid hemline that floats around the midsection, giving coverage and movement.Features- Sweetheart neckline- Wide shoulder straps- Slightly rounded, fluid hemlineFabric - 95% Bamboo, 5% LycraBlue Sky Fit Guide - true to sizeDaisy is 5'7 and wears size SMALL."
84,"Fion Tank, Brown",tank,"{20,Brown,Rayon,sale,Tank,Viscose}","DescriptionA light and flowy tank with wide shoulder straps and a cropped hem. Ideal for hot summer days, the Fion Tank is made of light Rayon fabric. Pair with slim-fitting shorts or capris.Features- Wide shoulder straps- Loose, flowy fit- Cropped lengthBlue Sky fit guide - true to size.Fabric - 100% plant-based Rayon"
85,FEATURE SLEEVELESS HOODIE,premium sleeveless hoodie,"{Nu,Psychedelic}","Vibrant all over front, back &amp; hood design100% premium soft-spun polyResistant to wrinkles, shrinking, abrasion and mildewPrint will never fadeHandmade with love in North America, just for you!Ships out in 7 - 10 business days."
86,Patchwork Hoodie / Rust Overdye,tops,"{Carleen,groupbycolour,Tops,usa}","Carleen's Patchwork Hoodies are garment-dyed, made from 100% recycled cotton and embellished with vintage patchwork blocks. Features vintage patchwork on chest, hood, and back. They handpick textiles that may include wear, distress, marks, and other signs of age intentionally to add to the character of the finished garment.Each hoodie is one-of-a-kind; photos show front and back of each piece in order from XS to LDetails:100% recycled cottonWash cold and inside out with like coloursMade in Los Angeles. About the brand:With her quirky prints and ultra-wearable styles, Carleen designer Kelsy Parkhouse pretty much had us at hello. Kelsy finds inspiration in her southern California roots. Folk-art motifs, fine art and domestic manufacturing are also mainstays for the emerging designer. After her thesis collection at the Pratt Institute found rave reviews in 2012 and receiving the inaugural Liz Clairborne Concept to Product Award, Kelsy ventured out on her own straight out of school and never looked back."
87,DARK GRIME MANDALA CROPTOP,croptop,"{Dark,Nu,Psychedelic}","Vibrant all over front &amp; back design100% premium soft-spun polyesterPrint will never fade, crack or wrinkleHandmade with love in North America, just for you!Ships out in 7 - 10 business days."
88,Top - Free People Colby Long Sleeve Tee,womens top,"{14Dec21,colby,free,ivory,long,""new arrival"",people,sleeve,tee,top,womens}","Free People Colby long sleeve teeSo cool and classic, this essential long sleeve tee from ther We The Free collection is featured in an oversized, slouchy silhouette with scoop neckline and exposed, raw seaming for a true lived-in look.Dropped shouldersRounded bottom hemThumbholesContrast sleeve cuffsSpecifically, this product was made with Eco-Conscious Design: It contains at least 50% of a certified eco-conscious fiber or process.50% Cotton50% GRS Certified Recycled Cotton"
89,"Marshalla Jacket, Icicle Houndstooth, Bamboo",jacket,"{50%,Bamboo,fw2020,fw2020report,Jacket,""Long Sleeve"",sale,Sunny,""Teal Zone"",Teal/Turquoise}","All the class of a chic blazer, with the comfort and breathability of Bamboo.The Marshalla features a crisp lapel, with a simple one-button closure and two front pockets. Princess seams flatter the shape and add femininity to the look. For the ultimate business casual look, pair the Marshalla with our matching Satine Pant. Professionalism and style, all wrapped in one! (4M4)Blue Sky fit guide - true to sizeFabric - 67% Bamboo 28% Cotton 5% Lycra"
90,Lydia Crop Top,tops,"{""crop top""}","The summer basic you're going to need in every colour! Amazingly soft, stretchy and double-lined. The perfect top for pairing with all of your high rise jeans, skirts, and shorts! We love the square neck and wide strap on this top.92% rayon, 8% spandextrue to size fitted style  "
91,Boyfriend Pullover Cotton Terry / Asphalt,tops,"{""Black Crane"",groupbycolor,Tops,usa}","A cozy oversized pullover with a crew neck and soft brushed inside. Designed with a boxy shape and dropped shoulder style.Details:100% cotton terryMade in the USALiza is 5'9"", size 6, wearing a size SAbout the brand:Black Crane is a brand created by Alexander Yamaguchi and Momoko Suzuki. Both with a strong focus on designing garments which are an extension of your lifestyle. They concentrate on silhouettes you should be comfortable in as well as complement your daily life. All garments are produced in Los Angeles."
92,Diana Hooded Cardigan,cardigan,"{521725,Cardigan,F21,""GABBY ISABELLA"",Jacket,MUST-HAVE,Sweater}","Style # 521725 - 08/08M3Playful and unique cardigan to wear in fall. Beautiful bold dots with lurex accents adorn the front. The lace-up back makes this a truly special piece. Fine gauge yarn provides softness and beautiful silhouette.Style: CardiganFit: RelaxedLength: 35.25""Open frontHoodLong sleevesFront pocketsFabric has stretchDesigned in CanadaMachine wash on gentle cycleComposition: 55% Acrylic, 45% Nylon"
93,Mesh Accent Dolman Sweater - NEW ARRIVAL,sweater,"{221909,""JOSEPH RIBKOFF"",Pullover,""Regular Price"",S22,Sweater}","Style # 221909 - 08/0900Super versatile, effortlessly chic, and a wardrobe must-have!Designed by Canada's favorite designer; Joseph Ribkoff this essential knit sweater features a viscose &amp; nylon-blend that is lightweight and complements the funky mesh cut-outs, long sleeves, boat neckline and slight high-low hem. Style with jeans, slim pants or a classic skirt. The options are endless!Style: Light sweaterFit: RelaxedLength: Slightly below hipsBoat necklineLong sleeves with ribbed cuffsDropped shouldersSlight high-low hemMachine wash inside out in cold waterComposition: 62% Viscose Rayon, 37% Nylon, 1% Polyester"
94,Grey Jacquard Short Vest,vest,"{11192,EVERSASSY,F21,Jacket,Vest}","Style # 11192 - 07/0854This unique vest is made with memory fabric, has a cropped silhouette and large collar! There’s no limit on layering opportunities with this comfortable vest. It looks great over tanks, turtlenecks, or long sleeved dresses and tops.Style: VestFit: StandardLength: WaistStand collarCross-over frontSingle button closureMemory fabricMachine wash in cold waterComposition: 100% Polyester"
95,David Bowie 1987 Tee,tops,"{_tab1_daydreamer-sizing,_tab2_atb-daydreamer,_tab3_care-daydreamer,blouse,clothing,daydreamer,tops}","The longest and the most expensive and elaborate tour Bowie had embarked on in his career, the 1987 Glass Spider Tour was basically a full blown theatrical show. Using movement, dialogue, film and projected images, Bowie revealed himself as a man of many talents. Drawing some of the largest crowds and craze all over the world, the 1987 tour sold millions in minutes. Innovative, extravagant and full of overly ambitious dreams, the tour was almost a relief to wind up but went on to inspire many later acts. Wear it loud and wear it proud - the David Bowie 1987 Tour Tee imitates Bowie’s pretentious and weirdly magical energy on stage.THE SPECSMade from a soft 100% cotton, with a perfect hand feel and worn in lookMade from a heavier loose knit cotton jersey, the tour tee features an open feminine neckline and ultra-flattering draped sleeve. With a length that shows off all your assets, this style is accented with classic vintage blind stitchMade by your team of Daydreamers, right here in Los AngelesModel is wearing size SSize S measures chest width: 19"" length: 24"""
