,title,product_type,tags,body_html
0,"Mia Top, Ice Pinecones, Bamboo",top,"{""3/4 Sleeve"",333,50%,Bamboo,fw2020,fw2020report,""Long Sleeve"",sale,Sunny,""Teal Zone"",Teal/Turquoise,Top}","DescriptionFlattering whether worn loose or body-con. The Mia Top is made of stretchy Bamboo, and has two layers in the front for added structured. Bamboo is cool, so this double layer remains a comfortable option. A soft V-neckline suggests a vertical axis, and aligns with tapered shape down the body. T-shirt simplicity with a very shapely fit, the Mia a great choice for pairing with a variety of different pants and skirts.Features- Soft V-neckline- 3/4 length sleeves- Two layers in the front- Tapered shape down the bodyBlue Sky fit guide - true to size for a body-con fit, or go up one size for a slightly relaxed fit.Fabric - 95% Bamboo, 5% Lycra"
1,Ladybug Long Sleeve,tops,"{_tab1_free-people-sizing,_tab2_atb-free-people,_tab3_care-free-people,blouse,clothing,free-people,sale,tops,white}",Sweet corset-inspired long sleeve top featured in a textured stretch-knit fabrication with elastic neckline and ruffle trim detail.Button-down frontCropped silhouetteExaggerated yoking detailCare/ImportMachine Wash ColdMeasurements for size small Bust: 28 inLength: 16 inSleeve Length: 23 inContents41% Polyester1% Elastane58% Cotton
2,"Pearl Top, Secret Garden, Bamboo",top,"{20,Bamboo,Navy,sale,""Short Sleeve"",Sunny,Top,White}","Cross over top for all shapes. The dolman sleeve provides even more room in the upper body. Inside and outside ties; easy A-line over midsection and hip.Blue Sky fit guide - true to sizeFabric Content - 95% Bamboo, 5% Lycra"
3,CHROMA SLEEVELESS HOODIE,premium sleeveless hoodie,"{Nu,Psychedelic,""Sacred Geometry""}","Vibrant all over front, back &amp; hood design100% premium soft-spun polyResistant to wrinkles, shrinking, abrasion and mildewPrint will never fadeHandmade with love in North America, just for you!Ships out in 7 - 10 business days."
4,Rib Hacci Vagabond Tank,tops,"{_tab1_zsupply-sizing,_tab2_atb-zsupply,_tab3_care-zsupply,blouse,clothing,tops,white,zsupply}","We updated our popular Vagabond tank! The Rib Hacci Vagabond features the same great body as our traditional Vagabond, but this time in a stretch rib hacci knit fabric. This comfy tank has a flattering v-neckline, yoke back, and relaxed fit. With its soft feel and flattering fit, it is a style that you will want to have in every color.Rib Hacci: 53% Polyester, 43% Rayon, 4% Spandex"
5,BIG TRIPPIN HOODIE,premium hoodie,{},"Vibrant all over front &amp; back design100% premium soft-spun polyesterPrint will never fade, crack or wrinkleHandmade with love in North America, just for you!Ships out in 7 - 10 business days."
6,"Tessa Tee, White/Black Small Stripe, Bamboo",top,"{1019,Bamboo,basic,basic2022,regular,Stripe,Sunny,Top}","DescriptionThe Tessa offers easy wear with a touch of shaping, for a basic that flatters all. Fabric drapes gently, without pulling or catching around the hips and bottom. A shirt-tail hemline provides fluidity, ensuring a soft visual line. The Tessa Tee compliments trousers, capris and skirts of all cuts.Features- Scoop neck- Rounded hem- Slightly boxy cutBlue Sky fit guide - true to sizeFabric - 50% Bamboo 42% Modal 8% LycraSahara is 5'8"", and wears size XS. "
7,MICHAELANGELO PORTAL T,premium tee,"{Galaxy,Nu,Psychedelic,Space}","Vibrant all over front &amp; back design100% premium soft-spun polyesterPrint will never fade, crack or wrinkleHandmade with love in North America, just for you!Ships out in 7 - 10 business days."
8,Top - Dex Lace Trim Ruffle Top,womens top,"{15Mar22,1924031,dex,lace,""new arrival"",ruffle,top,trim,white,womens}",Dex lace trim ruffle top100% Cotton slub
9,Top - Jackson Rowe Cholla Henley,womens top,"{22Mar22,cholla,dollar,henley,jackson,""new arrival"",rowe,sand,top,womens}","Jackson Row Cholla henleyIs there anything more classic than a Henley Tee? There's something about this menswear-inspired piece that is so simple yet so timeless. This one is instantly elevated by a dropped shoulder and a cuffed short sleeve.It sits at the hips, making it perfect on its own or tucked into your favourite pair of high-waisted mom jeans. Comfortable and stylish, like we do.95% Lyocell, 5% ElastaneFit: CLASSIC — follows your contours with a little room. "
10,"Connie Tank, Violet, Bamboo",tank,"{10,Bamboo,Blue,Purple,sale,Tank}","The Connie camisole is multi-purpose: four-season, and 24-hour. The softness and natural moisture-wicking qualities of bamboo combined with a touch of Lycra allow the Connie to lie close to the skin, providing a silky feel and flattering cut. A mid-cut?neckline falls perfectly, not too high or too scooped. Fabric spaghetti straps are positioned slightly closer to mid-point, and armholes are slightly higher - meaning that straps never slide off the shoulder. (4A1)Wear as summer tank to stay cool, as winter under-layering.Blue Sky Fit - generousFabric - 95% Bamboo, 5% Lycra"
11,"Snowy Thermal, Sunstone",tops,"{_tab1_free-people-sizing,_tab2_atb-free-people,_tab3_care-free-people,blouse,clothing,free-people,groupbycolor,sale,tops}","An effortless essential from Free People's We The Free collection, this timeless thermal long sleeve is featured in an oversized, slouchy silhouette with exposed seaming for the perfect lived-in look.Rounded bottom hemWide scoop necklineSide slitsCare/ImportMachine Wash ColdMeasurements for size smallBust: 42 inLength: 30.5 inSleeve Length: 29.5 inContents21% Nylon31% Polyester48% Viscose"
12,Brooks Women's Eat. Sleep. Run. Repeat. Podium L/S Light Grey Heather,shirts,"{Shirts,Sportswear,Tops,Women's}","221093072Eat. Sleep. Run. Repeat. It's your mantra and way of life, now show it off to everyone with this technical run shirt from Brooks.Fabric100% polyesterMoisture-wicking fabricFlatlock seams"
13,BAD CANDY CROPTOP,croptop,"{Nu,Psychedelic,Space}","Vibrant all over front &amp; back design100% premium soft-spun polyesterPrint will never fade, crack or wrinkleHandmade with love in North America, just for you!Ships out in 7 - 10 business days."
14,Roxy Women's Essentials Long Sleeve Hooded UPF 50 Zipped Rashguard,hoodies,"{Hoodies,""Hoodies and Pullover"",Rashguard,Swim,Tops,Women}","Upgrade your surf gear with this hooded long sleeve rashguard of the Core Basics Collection. We use sustainable REPREVE™ fabric with elastane for an immense amount of stretch and flexibility. The front zip closure works to keep water out so you can comfortably shred.Highlights:Recycled Fabric: Printed REPREVE™ traceable, recycled polyester made from plastic bottlesFit: Classic, comfortable regular fitUV Protection: UPF 50 sun protectionFull zip-up closure on frontScreen print logo on sleeve and chest86% Recycled Polyester, 14% ElastaneThe model is 175cm/5'9"" tall and wears a size S in the photo"
15,RICK GREEN HOODIE,premium hoodie,"{Funny,Galaxy,Nu,Psychedelic,Space}","Vibrant all over front &amp; back design100% premium soft-spun polyesterPrint will never fade, crack or wrinkleHandmade with love in North America, just for you!Ships out in 7 - 10 business days."
16,Everly Blouse,tops,"{_tab1_kivari-sizing,_tab2_atb-kivari,_tab3_care-kivari,blouse,blush,clothing,kivari,tops,white}","Introducing Everly, designed with soft citrus-toned romantic florals on a fresh white base. Bursting with bohemian charm, the Everly Blouse is crafted from 100% cotton voile. Featuring a high neck, ruffle sleeves, delicate lace trims and pin tucking through the front and back yokes. Style with the Everly Shorts for a matching ensemble.Fits true to sizeButton-through front 100% Cotton VoileModel wears a size 8 and is 178cm tall"
17,Outline Face Print Popover Shirt - NEW ARRIVAL,top,"{""CHARLIE B"",Cotton,S22,TOP}","STYLE # C4188W - 03/0979Pull on this light and airy blouse for instant style and comfort this spring and summer season. With its relaxed fit and long sleeves that you can roll up, this blouse is a perfect top for unpredictable weather. Dress it up with a nice pair of pants, or casually wear it with jeans. Half-button blouseLong roll-up sleevesMao collarFront pocketComposition: 80% Cotton and 20% Modal"
18,Women's Go Higher Tri-blend T Shirt - Canyon Rose,t-shirt,{clothing},"Women's Go Higher 2021 T ShirtColour: Canyon RoseLightweight and super soft, this women's t-shirt offers a comfortable and casual fit perfect for on the go.  Part of our relaxed collection this go to basic features a crew neck and short sleeves.  Made from our extremely popular heather CVC fabric, this t-shirt sports a vintage textured look. Fabrication: Heather CVC - 52% Airlume combed and ring spun cotton, 48% poly, 32 single 4.2 oz.Sizing chart: Body Width     S   18 1/2""    M   20""    L    22""    XL  24""Body Length    S   25 1/4""   M   26""    L   26 3/4""   XL   27 1/2"" "
19,"Sherry Jacket, Black, Bamboo",jacket,"{50%,Bamboo,Black,Jacket,sale,Sunny}","DescriptionWith short sleeves, the Sherry functions as a great layering piece. This open jacket falls from the shoulders, tapers slightly at the high waist, and flares just a touch around the high hip. Front panels are lightly rounded, adding movement around the hips and contrast with the fitted shoulder. This subtle shaping flatters the upper body with both shape and flow. Pair the Sherry Jacket with our Ritzy or Marcie Tanks for a clean and cohesive look.Features- Short sleeves- Slightly rounded front panels- Easy drapingBlue Sky fit guide - true to size.Fabric - 95% Bamboo, 5% Lycra"
20,"Kim 3/4 Sleeve Top, Teal Rosebush, Bamboo",top,"{Bamboo,Black,Print2022,regular,ss2022,Sunny,Teal,""Teal Zone"",Top}","DescriptionOur Kim Top has just the right touch of femininity, balanced with extra room in all the right places. Soft, stretchy Bamboo fabric makes for a fitted bodice that is flattering and comfy. Below the bodice, an empire seam with a dropped point at centre-front, which creates a vertical line to elongate the body. Fabric flares out from the empire seam to provide coverage and a touch of elegance. Sophisticated and simple, the Kim looks great with slim pants and skirts. Features- Deep, scoop neckline- Fitted bodice- Empire seam with fit and flare shapeBlue Sky fit guide - true to sizeFabric - 95% Bamboo, 5% Lycra"
21,"Combo Tee, Grey Scrollwork, Batik Art",top,"{""3/4 Sleeve"",50%,Black,fw2020,Lynn,Rayon,sale,Top,Viscose}",Not mention
22,Neuw Hood - Camel,shirts,"{Australia,camel,cotton,denim,""denim wear"",denimwear,hood,hooded,hoodie,hoody,""Mens Clothing"",menswear,neutral,Neuw,New.Neuw,pocket,pullover,Rollas,shirt,summer,sweater,time,top}",This thick hood is perfect staple for your wordrobe with a large front pouchFinished with a double home logo &amp; drawstingLarge front pouch pocketRibbed cuffs &amp; matching waistband100% CottonMaterial 100% cottonMade in China
23,COTTON CANDY & LAVENDER SLEEVELESS HOODIE,premium sleeveless hoodie,"{Psychedelic,""Sacred Geometry""}","Vibrant all over front, back &amp; hood design100% premium soft-spun polyResistant to wrinkles, shrinking, abrasion and mildewPrint will never fadeHandmade with love in North America, just for you!Ships out in 7 - 10 business days."
24,"Fion Tank, Fuchsia",tank,"{20,Purple,Rayon,sale,Tank,Viscose}","DescriptionA light and flowy tank with wide shoulder straps and a cropped hem. Ideal for hot summer days, the Fion Tank is made of light Rayon fabric. Pair with slim-fitting shorts or capris.Features- Wide shoulder straps- Loose, flowy fit- Cropped lengthBlue Sky fit guide - true to size.Fabric - 100% plant-based Rayon"
25,"Opra Jacket, Black, Bamboo",jacket,"{50%,Bamboo,Black,Jacket,sale,Sunny}","Both an accent piece and a basic, the Opra jacket is a fashion essential.Slightly A-line, the Opra falls in an elegant drape from shoulders to mid-thigh. Flat front panels establish a long lean shape down the body. A box pleat at CB allows the fabric to drape easily in the back as well, repeating the soft line from neck to thigh.Wear the Opra to work as a jacket, in the evening as an accent shrug, or throughout the day for a polished, all-purpose look. The long sleeves showcase accessories, or sit easily when pushed up.Blue Sky fit guide - generousFabric - 95% bamboo, 5% Lycra"
26,PSYCHED OUT HOODIE,premium hoodie,{},"Vibrant all over front &amp; back design100% premium soft-spun polyesterPrint will never fade, crack or wrinkleHandmade with love in North America, just for you!Ships out in 7 - 10 business days."
27,GRIME MANDALA SWEATSHIRT,premium sweatshirt,"{Nu,Psychedelic}","Vibrant all over front &amp; back design100% premium soft-spun polyesterPrint will never fade, crack or wrinkleLight fleece inner liningHandmade with love in North America, just for you!Ships out in 7 - 10 business days."
28,"Jazz 3/4 Slv Top, Beachwaves, Bamboo",top,"{50%,Bamboo,sale,ss2020,Sunny,Teal,Top}","DescriptionThe sleeved version of our Jazz Tank, the Jazz 3/4 offers the same forgiving fit and wardrobe versatility. Designed so that fabric floats away from the body, creating a softened visual effect and clean finish. A longer hemline in the back and sleeves provide coverage. Our Bamboo fabric makes the Jazz breathable and thin enough for layering.Features- U-neckline- 3/4 length sleeves- A-line shape- Shirt-tail hemlineBlue Sky fit guide - generousFabric - 95% Bamboo, 5% LycraLength Measurements, Top of Shoulder to Bottom of Hemline (cm)XXSXSSMLXL1X2X3X4X65676971737577808284<!--.tb_button {padding:1px;cursor:pointer;border-right: 1px solid #8b8b8b;border-left: 1px solid #FFF;border-bottom: 1px solid #fff;}.tb_button.hover {borer:2px outset #def; background-color: #f8f8f8 !important;}.ws_toolbar {z-index:100000} .ws_toolbar .ws_tb_btn {cursor:pointer;border:1px solid #555;padding:3px}   .tb_highlight{background-color:yellow} .tb_hide {visibility:hidden} .ws_toolbar img {padding:2px;margin:0px}-->"
29,Short Ribbed Cardigan,cardigan,"{32968,Cardigan,F21,""SOYA CONCEPT"",Sweater}","Style # 32968 - 08/0895This timeless sweater will add a feminine touch to any outfit. With its open silhouette, and soft ribbed fabric, this is a great piece for transitioning seasons. We like to keep it simple and style with a white t-shirt, denim skirt and fun slip-on shoes.Style: Open CardiganFit: StandardLength: Below hipsRibbed fabricMax Shrinkage: 5%Long sleeves with ribbed cuffsRibbed hemMachine wash in cold waterComposition: 65% Polyester, 35% Viscose"
30,Drawstring Cowl Neck Top,top,"{""JOSEPH RIBKOFF"",TOP}","Style # 213608 – 03/0804Made with a light &amp; stretchy fabric, this (must-have) top features short sleeves, line pattern, drawstring cowl neckline and relaxed fit that create a casual and unique garment to add to your wardrobe. Whether you wear it with your favourite jeans or pair with a comfortable legging, it’s a closet must-have!Style: Cowl topFit: RelaxedLength: Below hipDrawstring cowl necklineShort sleevesMade in CanadaMachine wash in cold water on gentle cycleComposition: 96% Polyester, 4% Spandex"
31,ENLIGHTENED EARTH HOODIE,premium hoodie,"{Nu,Psychedelic}","Vibrant all over front &amp; back design100% premium soft-spun polyesterPrint will never fade, crack or wrinkleHandmade with love in North America, just for you!Ships out in 7 - 10 business days."
32,Abstract Layer Mock Neck Top,top,"{71650,Dolcezza,F21,TOP}","Style # 71650 - 03/0897This stylish long sleeve top adds a trendy look to any outfit. The mock neck creates a flattering silhouette and it’s a perfect chilly weather basic. Style: TopFit: StandardLength: Slightly below hipsMock necklineLong sleeves Key hole backMachine wash inside out on gentle cycleComposition: 62% Polyester, 33% Viscose, 5% Elastane"
33,"Combo Tee, Flower Garden, Batik Art",top,"{Black,Blouse,carryover,fw2021,""Grey Zone"",Lynn,Rayon,regular,ss2020,Viscose}","Description:The hand-batiked prints are fresh and artistic, while natural fibre regulates body temp, keeping you cool when needed. Flat binding at neckline and sleeves. Fabric falls easily from the bust, floating around the hips for great wearability. An asymmetrical front pocket adds visual richness.Blue Sky Fit Guide: true to size in shoulders and bust; fuller around midriffFabric:  100% plant-based, wrinkle-resistant rayonThe model is 5'6"" and wears size M.Length Measurements, Top of Shoulder to Bottom of Hemline (cm)XXSXSSMLXL1X2X3X4X68697275788082848586 <!--.tb_button {padding:1px;cursor:pointer;border-right: 1px solid #8b8b8b;border-left: 1px solid #FFF;border-bottom: 1px solid #fff;}.tb_button.hover {borer:2px outset #def; background-color: #f8f8f8 !important;}.ws_toolbar {z-index:100000} .ws_toolbar .ws_tb_btn {cursor:pointer;border:1px solid #555;padding:3px}   .tb_highlight{background-color:yellow} .tb_hide {visibility:hidden} .ws_toolbar img {padding:2px;margin:0px}-->"
34,"Keirra Jacket, Black, Bamboo",jacket,"{20,Bamboo,Black,Jacket,sale,Sunny}","Wide dolman sleeves, for generous overlayer shape that narrows down the thigh. A shawl collar extends to the hemline, and two big patch pockets ground the look: ready, all-purpose, capable.Wear the Keirra as a wrap for office, or as a light jacket for spring/summer.Blue Sky fit guide - a generous fit across the back; go down a size. Excellent choice for women who are full in the bust.Fabric - 67% bamboo, 28% cotton, 5% Lycra"
35,Weekend Rush Button Down,tops,"{_tab1_free-people-sizing,_tab2_atb-free-people,_tab3_care-free-people,blouse,clothing,free-people,sale,tops}",The perfect boxy button-down top featured in a slouchy cropped silhouette designed in a textured cotton fabrication.Side slitsExposed seam detailDropped raglan short sleevesMachine Wash Cold100% Cotton
36,Good hYOUman Women's Apple - Live Your Way Everyday Clay,shirts,"{""good hyouman"",shirt,sportswear,tops,womens}","191740PMeet the Apple! Our newest short-sleeve tee! The Apple has a relaxed fit, crew neck, and dropped shoulder sleeves. This casual tee goes with everything in your closet! Skirts, jeans, sweats, you name it!Crafted from our cotton slub fabric, this tee features varying yarn textures resulting in an ultra-soft vintage look and feel! This is a women's style intended to have a relaxed fit throughout the body. Female model is 5'8"" and is wearing a size S. This style is a bit oversized.100% Cotton // 50% Modal // Machine Wash Cold // Tumble Dry Low"
37,Nike Men's Pro Short-Sleeve Top Black,shirts,"{mens,nike,shirts,sportswear,tops}","BV5633-010SWEAT AND STRETCH.Perfect for wear on its own or as a layer, the Nike Pro Top is made with stretchy, sweat-wicking fabric that helps keep you dry and comfortable through your workout.Dri-FIT technology helps keep you dry and comfortable.Slightly longer back hem helps keep you covered while you bend and stretch. More Details Slim fit for a tailored feelFabric: Body: 91-93% polyester/7-9% spandex. Panels: 92% polyester/8% spandex.Material percentages may vary depending on color. Check label for actual content.Machine washImported91% POLYESTER9% SPANDEX"
38,"Fraser Sweater, Blue, 100% Merino Wool",sweater,"{fw2021,Men,regular,Sweater,Wool}",Fabric: 100% Merino Wool
39,"Chopra Jacket, Coffee, Bamboo",jacket,"{Bamboo,basic,basic2022,Brown,Jacket,regular,Sunny}","DescriptionBased off our popular Opra jacket, but without the points. The Chopra is slightly A-line, falling in an elegant drape from shoulders to mid-thigh. Flat front panels establish a long lean shape down the body. A box pleat at CB means fabric never clings, draping easily in the back.Wear to work as a jacket, in the evening as an accent shrug, or throughout the day for a polished, all-purpose look. The long sleeves showcase accessories, or sit easily when pushed up. Features- Box pleat at centre back- Slightly A-line- Slim, clean shapingBlue Sky fit guide - generousFabric - 95% Bamboo, 5% Lycra"
40,"Combo Tee, Blue Rose Garden, Batik Art",top,"{50%,""Batik Art"",Blue,Lynn,Rayon,sale,ss2020,Top,Viscose}","The hand-batiked prints are fresh and artistic, while natural fibre regulates body temp, keeping you cool when needed. Flat binding at neckline and sleeves. Fabric falls easily from the bust, floating around the hips for great wearability. An asymmetrical front pocket adds visual richness.Blue Sky fit guide - true to size in shoulders and bust; fuller around midriffFabric - 100% plant-based, wrinkle-resistant rayon"
41,Gabriella Funnel Neck Sweater,sweater,"{Cotton,""COTTON COUNTRY"",MUST-HAVE,PARKHURST,Pullover,Sweater}","Style #85143 – 08/0827Cozy up in this beautiful cable knit sweater! Made with recycled cotton, this sweater features a funnel neck, long sleeves and chunky knit. It is a timeless classic that will pair with everything in your closet for years to come.Style: PulloverFit: RelaxedLength: Slightly below hipsFunnel necklineLong sleeves with ribbed knit cuffsRibbed knit hemMachine wash in cold waterComposition: 75% Recycled Cotton, 25% Polyester"
42,Aretha Franklin Daydreaming Weekend Tee,tops,"{_tab1_daydreamer-sizing,_tab2_atb-daydreamer,_tab3_care-daydreamer,black,blouse,clothing,daydreamer,newarrivals,tops}","When the Queen of Soul dropped yet another hit, it was one we couldn’t help but gravitate toward: “Daydreaming.” With a title that touched us to the core, Aretha’s soul single, since covered by countless great acts, now lands on our latest weekend tee. Featuring a portrait of the 18 time Grammy winner, it’s only right that Aretha’s tee is designed in rich colors to match its soulful roots.THE SPECSMade from a soft 100% cotton, with a perfect hand feel and worn in lookAn intentionally oversized tee, made from a heavier loose knit cotton jersey with a classic crew neckline and slightly longer sleeves - perfect for cuffing. Made to fit you big, there’s no need to size up to achieve your borrowed from the boys lookMade by your team of Daydreamers, right here in Los AngelesModel is wearing size SSize S measures chest width: 19 3/4"" length: 26"""
43,Printed Cotton Blouse,blouse,"{EVERSASSY,Tunic}","Style # 61172 – 03/07BWThis airy top is a versatile choice for an easy-going style. The relaxed silhouette, cropped sleeves, and the slight high-low hemline are chic and figure-flattering. Pair with your favorite pants, skinny jeans or structured skirts. The options are endless!Style: BlouseFit: RelaxedLength: Below hipsFront buttonsClassic collarCropped sleeves with cuffsSlight high-low hemlineHand wash in cold waterComposition: 100% Cotton"
44,Spiritual Gangster Women's Amor Seamless Crop Tank Night,tanks,"{""Spiritual Gangster"",sportswear,tanks,tops,womens}","SP23676008-NVYDo all things with love in our best-selling seamless Amor Crop Tank, updated this season with a unique mineral wash treatment. Loved by fans of all shapes and sizes, it lifts and supports where you want it most, and the femme ruffle hem won’t dig in. So incredibly versatile you can wear it for a workout and a night out.Close, compressive fitBuilt-in shelf braRacerbackMerrowed edgeSG Free Seamless performance fabricSG Free SeamlessModel is 5'8"" / 32” Bust and wearing size XS/S"
45,Patagonia Women's Retro Pile Jacket Natural,shirts,"{outerwear,womens}","22795-NATInfluenced by our fleece heritage, but made modern with 100% recycled polyester double-sided shearling fleece, this jacket provides ultimate softness and warmth. Fair Trade Certified™ sewn.Made of plush 100% recycled polyester double-sided shearling for warmthThree mesh-lined pockets secure with Vislon® zippers, one chest and two handwarmers, which have grosgrain zipper pullsEdged with elastic binding around the collar, center-front zipper and hem Front and back yoke complete throwback aestheticHip lengthFair Trade Certified™ sewnRegular fit"
46,EPIC ECLIPSE CROPTOP,croptop,"{Galaxy,Nu,Space}","Vibrant all over front &amp; back design100% premium soft-spun polyesterPrint will never fade, crack or wrinkleHandmade with love in North America, just for you!Ships out in 7 - 10 business days."
47,OVERSIZED TWO POCKET CARDIGAN - BLACK,cardigan,"{black,""double pocket"",gastown,hooded,mens,oversized,sweaters}","Our best selling coatigan is back!  Don't miss out!Chunky and cozy scarf neck hooded cardigan with pockets in black.60% ACRYLIC, 30% SPANDEX, 10% POLYESTER"
48,"Kendall Sweater, Black",sweater,"{20,""Bamboo Cotton"",Black,sale,Sunny,Sweater}","Accent piece in cotton/bamboo, for cool wear and layering year-round.The Kendall sweater has gentle tapering under the arms, for a fitted shape that falls easily over the hip.Blue Sky fit guide - true to size, or choose a size down for a slimming silhouetteFabric - 50% cotton, 50% bamboo"
49,Cool Cat Tank Top,tank,"{Dolcezza,""Mother's Day"",Sporty,Tank}","Style # 21149 – 03/07L6Take on the season with style!This lightweight viscose-blend top features a fun ‘cool cat’ print, a round neckline and sleeveless style. We love to style this blouse with light coloured ankle pants and a denim jacket for an edgy and on-trend outfit.Style: TankFit: StandardLength: HipRound necklineSleevelessHand wash separately in cold waterComposition: 96% Viscose, 4% Elastane"
