,title,product_type,tags,body_html
146,WORD IS WORLD SPORTS BRA,sports bra,"{Nu,Psychedelic}","Vibrant all over front &amp; back design100% premium soft-spun stretchy poly for comfortResistant to wrinkles, shrinking, abrasion, and mildewPrint will never fadeHandmade with love in North America, just for you!Ships out in 7 - 10 business days."
147,Scoop Me Up Racerback,default,"{""free people"",tanks,tops,womens}","So comfy, formfitting racerback bra featured in a ribbed design with a plunging V-neckline and a skinny T-style racerback.Easy stretch fitLongline silhouettePullover style"
148,Triblend V-Neck,default,"{mens,""national standard"",""s/s t"",tops,white}","TRI-BLEND V-NECK IN WHITE IS A SLIM FIT T-SHIRT IN A SOFT TRI-BLEND FABRIC. THE ORIGINAL BASIC, BACK BY POPULAR DEMAND.50% POLY 38% COTTON 12% RAYONWEARS AND WASHES WELLRIBBED COLLARTWO NEEDLE TOP STITCH FINISHMODEL IS 6'2 AND IS WEARING A SIZE MEDIUM"
149,ABSTRACT WAVES BLACK STRING BIKINI TOP,black string bikini top,"{Nu,Psychedelic}","Vibrant all over designPremium 4-way stretch polyester/spandexPrint will never fade, crack or wrinkleUltra stretchy comfort stringsHandmade with love in North America, just for you!Ships out in 7 - 10 business days."
150,BEES SWEATSHIRT (Clearance),ready to ship,"{""Ready To Ship""}","This item is already made and ships out within 5 business days.Out of your size? Don't worry, order HERE100% soft-spun premium polyesterVibrant all over front &amp; back print Fade, crack &amp; wrinkle resistantLight fleece liningOur sweaters are made with love one at a time,Cut, sewn &amp; hand finished.. just for you!"
151,ACID GORILLA HOODIE,premium hoodie,"{Animals,Nu,Psychedelic}","Vibrant all over front &amp; back design100% premium soft-spun polyesterPrint will never fade, crack or wrinkleHandmade with love in North America, just for you!Ships out in 7 - 10 business days."
152,"Lounge L/S Boat Neck "" Lightweight Rib"" / Black",tops,"{groupbycolor,stateside,tops}","Lightweight rib lounge boatneck. Designed with a slight v boat neckline and form fitting shape.Details:50% Supima, 50% micromodalMade in the USANykita is 5'7, size 2/4, wearing a small"
153,Check On It Wrap Top,tops,"{_tab1_free-people-sizing,_tab2_atb-free-people,_tab3_care-free-people,blouse,clothing,free-people,tops}","In a wrap-style silhouette with a surplice neckline, this long sleeve top features an allover pleated design.Hook front closureCinched sleevesDraped design19% Nylon, 81% ViscoseDry Clean Only"
154,TRIPZY LEARY	ZIP UP HOODIE (Clearance),ready to ship,"{""Ready To Ship""}","This item is already made and ships out within 5 business days.Out of your size? Don't worry, order HERE100% soft-spun premium polyesterVibrant all over front &amp; back print Fade, crack &amp; wrinkle resistantFront pocket, strong zipper &amp; soft inner hood liningOur zip-hoodies are made with love one at a time,Cut, sewn &amp; hand finished.. just for you!"
155,Rolling Stones Shrunken,default,"{22q1,daydreamer,""s/s t"",tops,woman,womens}","You have the original, but what about the remastered edition? Reissuing our top selling Rolling Stones tongue and lips graphic, this teeny tee has the authentic Y2K fit and feel you’re after. Back and better than ever, the 2.0 version has smaller sleeves and a shrunken body that hits right at the hips. Style it with a pair of loose-fitting jeans, pleated skirt, or denim cut-offs – it’s a versatile option for your wardrobe and suits just about everything."
156,DRAGONS ONLY LOOSE DROP SHOULDER GRAPHIC CROP T,graphic croptee,"{Animals,Nu,Psychedelic}","Soft DTG print100% Airlume combed and ring-spun cottonSmall chest print/large back print with sleeve logoRelaxed fit with Oversized sleevesHandprinted with love in the USA, just for you!Ships out in 2 - 5 business days. Size guide SMLLength (inches)19 ½20 ⅜22Chest (inches)20 ¼21 ¾23 ¾"
157,"Now Tunic, Lipstick Curls, Batik Art",blouse,"{50%,Black,Blouse,fw2020,""Lipstick Zone"",""Long Sleeve"",Lynn,Rayon,Red,sale,Top,Tunic,Viscose}","DescriptionLive in the Now...trust us, you will be when wearing this tunic.The Now has the style of a blouse, with plenty of coverage. An A-line shape tapers away from the body, ending in a slight shark-bite hemline at high thigh. Long sleeves make slipping on coats a breeze, plus a button up front and two pockets add functionality. The collar is slim and can be worn flipped up or down.Makes for a stunning statement piece when paired with black leggings or pants, and is easy to dress up with jewelry and shoes.Features- A-line shape- Long sleeves- Button-up front- Two front pocketsBlue Sky fit guide - true to size.Fabric - 100% plant-based Rayon<!--.tb_button {padding:1px;cursor:pointer;border-right: 1px solid #8b8b8b;border-left: 1px solid #FFF;border-bottom: 1px solid #fff;}.tb_button.hover {borer:2px outset #def; background-color: #f8f8f8 !important;}.ws_toolbar {z-index:100000} .ws_toolbar .ws_tb_btn {cursor:pointer;border:1px solid #555;padding:3px}   .tb_highlight{background-color:yellow} .tb_hide {visibility:hidden} .ws_toolbar img {padding:2px;margin:0px}-->"
158,Vintage Suede Brown Jacket,Not mention,{},"S/m, Suede"
159,Women's Tempo Hoodie UPF 50+,shirts and tops,"{Hoodies,Tops,Women}","The Tempo Hoodie is the UPF 50+ activewear you've been looking for! It has thumbholes, a kangaroo pocket, and a hood for when the sun is too hot or you forgot your hat. Our Fitness Hoodie is made out of our Active Athlon fabric with the added bonus of our Cooltect™ technology. You can be active in this fitted Fitness Hoodie without getting uncomfortably hot. So go ahead and enjoy sun-safe biking, walking, running and so much more!Highlights:UPF 50+Raglan long sleeves with thumbholesWelt kangaroo pocketHoodedActive Athlon™ fabric: Lightweight and breathable with moisture wicking for quick dry performanceCooltect™ technology accelerates moisture wicking to keep you cooler and more comfortable"
160,Don’t Panic Graphic Tee,Not mention,{},For our herb-friendly people. Custom bleach dyed to give it a bit of uniqueness.Fits Medium
161,SUGAR HIGH PANDA CROPTOP,croptop,"{Animals,Funny,Nu}","Vibrant all over front &amp; back design100% premium soft-spun polyesterPrint will never fade, crack or wrinkleHandmade with love in North America, just for you!Ships out in 7 - 10 business days."
162,Vintage 90s Varsity Jacket,Not mention,{},"Size SmallFits slightly oversizedVintage from the 1990sDisclaimer: Not all clothing fits the model wearing the item, sometimes clothing clips are used. Digital electronics may alter the true colour of a product. Items are vintage and/or second hand."
163,"Margorie Top, Stained Glass, Bamboo",top,"{""3/4 Sleeve"",50%,Bamboo,Blue,""Earth Zone"",marjorie,sale,ss2021,Sunny,Top}","DescriptionSlim-fitting style, in a chic 3/4 sleeve top.The Margorie has a trim fit in shoulders, falling into a shorter cut, with ease at hips. A high, round neckline creates a smooth finish on the body, and simplifies layering. 3/4 length sleeves make for an elegant look, allowing this top to be worn with everything from simple pants to a skirt for a night out. Just add a string of pearls and you're all set! (4C3) Features- High, round neckline- 3/4 length sleeves- Hem falls to high hipBlue Sky fit guide - true to sizeFabric - 50% Bamboo, 42% Modal, 8% Lycra<!--.tb_button {padding:1px;cursor:pointer;border-right: 1px solid #8b8b8b;border-left: 1px solid #FFF;border-bottom: 1px solid #fff;}.tb_button.hover {borer:2px outset #def; background-color: #f8f8f8 !important;}.ws_toolbar {z-index:100000} .ws_toolbar .ws_tb_btn {cursor:pointer;border:1px solid #555;padding:3px}   .tb_highlight{background-color:yellow} .tb_hide {visibility:hidden} .ws_toolbar img {padding:2px;margin:0px}--><!--.tb_button {padding:1px;cursor:pointer;border-right: 1px solid #8b8b8b;border-left: 1px solid #FFF;border-bottom: 1px solid #fff;}.tb_button.hover {borer:2px outset #def; background-color: #f8f8f8 !important;}.ws_toolbar {z-index:100000} .ws_toolbar .ws_tb_btn {cursor:pointer;border:1px solid #555;padding:3px}   .tb_highlight{background-color:yellow} .tb_hide {visibility:hidden} .ws_toolbar img {padding:2px;margin:0px}-->"
164,Quilt Liner Jacket,coats + jackets - shoulder season,"{Carleen,""Coats + Jackets"",groupbycolr}","Inspired by the classic quilted nylon army liner, this jacket is made from one-of- a kind salvaged vintage quilts, with black linen trim and front snap closure.""This jacket features one of a kind textiles that we hand picked. They may include wear, distress, marks, and other signs of age intentionally as we believe this adds to the character of the finished garment.""Photos show each jacket in order of size from small to largeDetails:Made from Vintage textiles and linen trimMade in LADry-cleaning recommended"
165,Women's Accelera Tee UPF 50+,shirts and tops,"{Shirts,Women}","Our moisture wicking shirt is engineered to keep up with your active lifestyle! Packed with high-performance features and sporty design details, this UPF 50+ hi lo top feels just as good on the inside as it performs outside!Highlights:UPF 50+Crew necklineFlatlock seams to reduce chaffingSleeve opening wraps to create a thumbhole and give extra hand coverageHigh-low hem with overlapped side panels for ease of movementRaglan sleevesCross-over pleat at yoke for a relaxed look and feelAntimicrobial protection infused at the fiber level prevents the growth of 99.9% of bacteria to help eliminate odor.Cooltect™ technology accelerates moisture wicking for a cooler workoutActive Athlon™ fabric: Lightweight and breathable with moisture wicking for quick dry performanceActive Athlon™ FabricOur Active Athlon fabric is engineered for cutting-edge performance and comfort, including our exclusive Cooltect™ technology that accelerates moisture wicking for a cooler workout and an antimicrobial finish that helps keep the fabric fresh. It’s soft, lightweight, breathable, moisture wicking and quick dry to keep you active all day."
166,Amita Knit Tank,default,"{21q3,amuse,tanks,tops,womens}",The basic you didn't know you needed. The Amita Knit is a trendy sweater knit tank in the perfect deep-v cut.
167,Anne Cole Ladies twist front top,Not mention,{},Anne Cole twist front topmulti
168,FUTURE MANDALA TANKTOP,premium tanktop,"{Nu,Psychedelic,""Sacred Geometry""}","Vibrant all over front &amp; back design100% premium soft-spun polyesterPrint will never fade, crack or wrinkleHandmade with love in North America, just for you!Ships out in 7 - 10 business days."
169,OVERSIZED TWO POCKET CARDIGAN - MOCHA,cardigan,"{""double pocket"",gastown,hooded,mens,mocha,oversized,sweaters}","Our best selling cardigan is back!  Don't miss out!Chunky and cozy scarf neck hooded cardigan with pockets in mocha colour.60% ACRYLIC, 30% SPANDEX, 10% POLYESTER"
170,Space Jam Vintage Tee,Not mention,{},Medium 
171,"Cameron Sweater, Deep Blue, Bamboo Cotton",sweater,"{""Bamboo Cotton"",basic,basic2022,Blue,regular,Sunny,Sweater}","DescriptionWe have the ultimate mock neck sweater. The Cameron is sleek and functional, providing a good base for accessories or other layers. Our Bamboo/Cotton fabric is temperature-regulating, ensuring you won't overheat. Thanks to a superb fit, the Cameron can be worn with a wide variety of other garments. Truly a versatile piece!Features- Mock neck- Ribbing at neckline and cuffs- Slim fittingBlue Sky fit guide - true to size.Fabric - 50% Bamboo, 50% CottonHelen is 5'8"", and wears size XS."
172,Vintage Yellow Work Jacket,Not mention,{},M
173,Basic Tee / Terracotta,tops,"{groupbycolor,Jungmaven,Tops,unisex}","""The lightest weight relaxed fit shirt you'll wear all summer long. Here's a shirt that ventilates and breaths, it makes you feel good just wearing it. If there's a base layer tee that could be worn under anything, it's the Basic Tee. Yoga in the Garden and on a Summer Morning Shirt.""Details:30% hemp, 70% organic cottonMade in USAChad is 6'4, typically wears an XL , and is wearing an XL"
174,Salomon Men's Agile FZ Hoodie Goji Berry,jackets,"{Jackets,mens,salomon,sportswear,tops}","LC1494500The breathable, hooded jacket that protects you on the trail.With reinforced, water-repellent fabric on the torso and more breathable materials elsewhere, the AGILE FZ HOODIE actively protects you from the elements. The elastic toggle-free hood, reflective trim, zipped pockets and stretchy fabric provide comfort and practicality wherever the trail takes you.BENEFITSWeather protection: Reinforced fabric on the body and back protects your core and repels moisture, while the smart, toggle-free elastic hood adds an extra layer protection.Breathable: Engineered with breathable fabric, this jacket helps you manage your body temperature and prevent overheating.Active comfort: The pared-down design and stretchy fabric make it easy to move, however far or fast you want.FEATURES4-way stretch: The fabric stretches in all 4 directions with the support of elastic yarns.Air vent system: Salomon air vents are easy to open, allowing maximum air flow.NEED-TO-KNOW INFORMATIONBody: 100% Polyester; Body insert: 88% Polyester, 12% ElastaneRegular fit"
175,Ted Baker London Linen Blend Charcoal Sport Jacket,suits and sport jackets,"{Men's,""Sport Jacket"",Suit,""Ted Baker""}","This sport jacket by Ted Baker London features a contemporary look a lightweight fabric. The patch pockets and soft shoulder give this sport jacket a sporty look, making it easy to wear casually with light wash jeans. The style and colour are timeless, making it a great jacket for any wardrobe. Linen BlendMade in CanadaTed Baker Tailored FitTwo Button, Notch LapelDouble Vented1/4 Lined, Soft ConstructionDry Clean Only "
176,Patrick Assaraf Pima Cotton Printed T-Shirt in Blue,t-shirts and polos,"{Men's,""Patrick Assaraf"",T-Shirt}",Patrick Assaraf takes their iconic pima cotton stretch jersey and print it with sophisticated patterns to create a fun summer t-shirt. It is a comfortable fit and pairs superbly with understated trousers or shorts.95% pima cotton 5% spandexPrintedModern FitCrewneckMade in peru Machine wash - tumble dry 
177,Winslow,default,"{21q3,""gentle fawn"",shackets,tops,womens}","The Winslow jacket is the perfect transitional piece. The unique colour is achieved through garment dyeing, which gives it a soft, lived in look and feel. It features welt and patch pockets and a cinched back detail for a casual look."
178,Walk In The Park,tops,"{_tab1_free-people-sizing,_tab2_atb-free-people,_tab3_care-free-people,beige,blouse,canvas,clothing,cream,free-people,ivory,sale,tops}","Stun out in this timeless, button-front top with lace-adorned ruffle top detail for added dimension.¾ sleevesUneven bottom hemPleating at shouldersCare/ImportMachine Wash Cold GentleMeasurements for size smallBust: 48.5 inLength: 24.75 inSleeve Length: 14.5 in"
179,DENIM JACKET - TIE DYE,denim jacket,"{""blazers jackets coats"",denim,jacket,ss22,""tie dye"",victorious}",Men's denim jacket in Tie Dye colour. An original piece to add to your wardrobe. Button closuresButtoned chest pocketsSide slit pocketsLong sleeveClassic fit 100% Cotton DenimModel is 6’2” /  wears a size M
180,THE GIFT SPORTS BRA,sports bra,"{Galaxy,Nu,Psychedelic,""Sacred Geometry"",Space}","Vibrant all over front &amp; back design100% premium soft-spun stretchy poly for comfortResistant to wrinkles, shrinking, abrasion, and mildewPrint will never fadeHandmade with love in North America, just for you!Ships out in 7 - 10 business days."
181,TEE SHIRT - BURNT ORANGE,tee shirt,"{fw20,gastown,""jack jones"",long,mens,ochre,orange,red,""short sleeve"",tee,""tees long sleeves"",white}","PRODUCT DESCRIPTIONOne of the best selling long fit t-shirt year after the year. The trendy basic t-shirt features a curved hemline and all the softness and stretch you need in a t-shirt. This piece is perfect for layering or just to wear by itself.Regular fit100% CottonImportedMachine wash, tumble dry"
182,DISAMBIGUATION DROP TEE,drop tee,"{Nu,Psychedelic,""Sacred Geometry""}","Vibrant all over front &amp; back design100% premium soft-spun polyesterPrint will never fade, crack or wrinkleLong fit with rounded hemlineHandmade with love in North America, just for you!Ships out in 7 - 10 business days."
183,Geometric Print Tunic Top - NEW ARRIVAL,tunic,"{221266,""JOSEPH RIBKOFF"",""Regular Price"",RESORT,S22,Tank,TOP,Tunic}","Style # 221266 - 03/0900This stretchy, silky knit tunic looks amazing paired with skinny pants or basic black leggings. The sleeveless design is complemented by printed cowl neckline. The asymmetrical hem and geometric print are figure flattering and easy to wear.Style: TunicFit: StandardLength: Upper-thighSleevelessCowl necklineAsymmetrical hemMade in CanadaMachine wash in cold waterComposition: 96% Polyester, 4% Spandex"
184,Billabong Arch S/S Tee,mens tees,"{20-40,25-50,availability_in-stock,billabong,color_white,gender_men,macro-mens-clothing,mens-tees,size_large,size_medium,size_x-large,size_xxl,submacro-mens-shirts}","The Billabong Arch Short Sleeve T-Shirt features heritage logo graphics in soft-hand ink. Made from lightweight combed cotton jersey, this men’s short sleeve t-shirt is topped with a crew neckline and heat seal neck label.Features:Premium combed ring spun jersey.Lightweight feel.Crew neckline.Short sleeves.Softhand screen prints at chest and back.Heat seal neck label.Left side seam flag label.100% Cotton"
185,ABSTRACT GLITCH TANKTOP,premium tanktop,"{Nu,Psychedelic}","Vibrant all over front &amp; back design100% premium soft-spun polyesterPrint will never fade, crack or wrinkleHandmade with love in North America, just for you!Ships out in 7 - 10 business days."
186,Two Tie For You Brami,tops,"{_tab1_free-people-sizing,_tab2_atb-free-people,_tab3_care-free-people,blouse,clothing,free-people,tops}",Ultra cute brami featuring a front tie design with button closures.100% Polyester
187,ALIEN BRAINWASH GRAPHIC CROPTEE,graphic croptee,"{Galaxy,Nu,Psychedelic,Space}",Hand printed and made to order in 2 - 5 days.Soft long lasting DTG print.  • 52% combed and ring-spun cotton/48% polyester Size guide XS/SMM/LLength (inches)16 ½17 ½Width (inches)15 ⅝17 ⅛
188,HAPPY FACE GRAPHIC TEE,Not mention,"{""women tee""}","Original Hand Drawn Oversized ""Happy Face"" Mineral Washed Lotus Tee. Loose in all the right places. Featuring an open neckline and slightly dropped sleeves. Made in 200% Cotton Mineral Washed."
189,"Helena Cape, Black, Wool",coat,"{Black,Cape,fw2021,Jacket,regular,Sunny,Wool}","Fabric: 50% Wool, 50% Viscose<!--.tb_button {padding:1px;cursor:pointer;border-right: 1px solid #8b8b8b;border-left: 1px solid #FFF;border-bottom: 1px solid #fff;}.tb_button.hover {borer:2px outset #def; background-color: #f8f8f8 !important;}.ws_toolbar {z-index:100000} .ws_toolbar .ws_tb_btn {cursor:pointer;border:1px solid #555;padding:3px}   .tb_highlight{background-color:yellow} .tb_hide {visibility:hidden} .ws_toolbar img {padding:2px;margin:0px}-->"
190,Jay Ls Shirt 2.0 0299A,default,{},Not mention
191,Mixed Fabric Coat,coat,"{10811,coat,EVERSASSY,F21,Jacket,""winter jacket""}","Style # 10811 - 09/0850With the perfect combination of edgy and sophistication, this jacket will make any outfit look chic. It features front buttons, long sleeves, memory fabric bottom, wool-blend fabric top, lapel collar and long sleeves.Style: CoatFit: StandardLength: Above the kneeLapel collarFront buttonsMemory fabric bottomWool-blend topLong sleevesHand wash in cold waterComposition: 100% PolyesterCombo: 65% Wool, 35% Polyester"
192,PASTEL FUNDAMENTAL T,premium tee,"{Nu,Psychedelic}","Vibrant all over front &amp; back design100% premium soft-spun polyesterPrint will never fade, crack or wrinkleTenyo x Mattaio CollabHandmade with love in North America, just for you!Ships out in 7 - 10 business days."
193,Short Shrug,coverups,"{coverup,regular}","Create harmony and impact with colour.Add deep sea blue to cool turquoise, jeweled red to fiery orange, deep chocolate brown to warm almond. The language of colour evokes depth and luxuriance - and you can add this rich dimension to your wardrobe easily with our ponchos and wraps.Made from light rayon mesh, these accent pieces come in a wide spectrum of colour, from blues to reds to earth tones - and all subtle variations between.Choosing a shade or hue that complements an outfit and your skin tone can result in an immediate ""yes"": colour satisfies the eye in a basic and joyous way.Fit - one sizeFabric - 100% naturally-sourced rayon"
194,CRESCENT SWEATSHIRT,graphic sweatshirt,{Nu},"A pre-shrunk, classic fit sweater that's made with air-jet spun yarn for a soft feel.   • 8.0 oz., 50/50 cotton/polyester • Pre-shrunk • Classic fit • Reduced pilling and softer air-jet spun yarn • 1x1 athletic rib knit collar, cuffs and waistband, with spandex • Double-needle stitched collar, shoulders, armholes, cuffs and waistband Size guide SMLXL2XL3XL4XL5XLLength (inches)2627282930313233Width (inches)2022242628303234"
195,Bloom Country Crop Tee,Not mention,{},Medium
196,Lounge Crew / Graphite,tops,"{""bare knitwear"",groupbycolor,Knitwear,Tops}","""Designed for year around wear, The Lounge Crew is our all-season pullover. Both breathable and cozy, this medium weight pima cotton crew breathes during the warmer months and keeps you cozy throughout the winter. The simple design and easy to wear shape make the Lounge Crew an easy staple to pull on with anything in your wardrobe and wear on repeat. Matches with the Lounge Pant.""Details:Ethically made in Lima, PeruPairs beautifully with the matching Lounge Pant100% Oeko-Tex Certified Peruvian Pima Cotton.Pre-washed for shrinkageWill relax with wear and re-shape in the washMachine wash separately on a delicate cycle in cold water using a mild soapRe-shape and lay flat to dry on a clean surfaceIf hand washed, use a mild detergent in cool water and lay flat to dry on a towel. Avoid hanging, stretching or ringing out when garment is wet.Sydney is 5'4, size 0, wearing XS/S"
197,BARB SWEATSHIRT,premium sweatshirt,"{Psychedelic,""Sacred Geometry""}","Vibrant all over front &amp; back design100% premium soft-spun polyesterPrint will never fade, crack or wrinkleLight fleece inner liningHandmade with love in North America, just for you!Ships out in 7 - 10 business days."
198,TETRA SEED HOODIE (Clearance),ready to ship,"{""Ready To Ship""}","This item is already made and ships out within 5 business days.Out of your size???? Don't worry, order HERE100% soft-spun premium polyesterVibrant all over front &amp; back print Fade, crack &amp; wrinkle resistantFront pocket &amp; soft inner hood liningOur hoodies are made with love one at a time,Cut, sewn &amp; hand finished.. just for you!"
199,High Loose Short,shorts,"{_tab1_levis-sizing,_tab2_atb-levis,_tab3_care-levis,clothing,levis,shorts}","Let loose with this modern interpretation of a classic '90s style. These shorts have a relaxed fit and flattering high rise. A-line shape. Sustainably made with TENCEL™ fabric79% Cotton, 21% Lyocell (Lenzing Tencil)Non- StretchZip Fly High RiseRelaxed Through HipClean Hem"
200,TECHNOLOGY HOODIE,premium hoodie,"{Galaxy,Nu,Psychedelic,""Sacred Geometry"",Space}","Vibrant all over front &amp; back design100% premium soft-spun polyesterPrint will never fade, crack or wrinkleHandmade with love in North America, just for you!Ships out in 7 - 10 business days."
201,Fox Men's hoodie,mens clothing,{},Fox fleece pullover
202,Lilac Flower Bra,Not mention,"{Apparel,Lingerie,Tops,Women's}","Brand La Senza, 34B, single hook closure, adjustable straps."
203,Cito,default,"{22q1,blouse,rails,""s/s t"",tops}","Lightweight, breezy linen fabric mixed with a relaxed body shape makes the Cito the perfect Southern California inspired button-down. This crisp white button-down shirt features tonal dune brown stripes, a relaxed fit, two patch pockets at chest, and a high-low hem.55% Linen | 45% Rayon. Imported.CARE | Hand Wash Cold. Hang Dry. Do Not Bleach. Cool Iron If Necessary.FIT | Recommend ordering true to size. Front Body Length: 27"" (Measured from Small)"
204,"Slim Crop, Black, Bamboo",Not mention,"{50%,Basic,new,sale}",50% Bamboo 42% Modal 8% Lycra
205,Definition Tee- Black,t-shirt,{clothing},"Definition TeeFeaturing our Scope Definition LogoColour: Black TriblendFabric: 50% polyester, 25% airlume combed and ring-spun cotton, 25% rayonSizing: S (fits 2-4), M (fits 6-8), L (fits 8-10), XL (fits 10-12)"
206,Dream Cable Crew,sweaters,"{_tab1_free-people-sizing,_tab2_atb-free-people,_tab3_care-free-people,clothing,free-people,sale,sweaters}","So effortless in a classic crew neck silhouette, this timeless sweater features contrast knit detailing throughout in a staple silhouette for timeless style from season to season.CareHand Wash ColdMeasurements for size smallLength: 21.5 inSleeve Length: 20 inBust: 43 inContents40% Acrylic60% Cotton"
207,"jazz tank, Seaside, Bamboo",top,"{20,Bamboo,blueskygarments,sale,""Short Sleeve"",sunny,""Teal Zone"",Teal/Turquoise,tent2021,Top}","DescriptionThe Tessa offers easy wear with a touch of shaping, for a basic that flatters all. Fabric drapes gently, without pulling or catching around the hips and bottom. A shirt-tail hemline provides fluidity, ensuring a soft visual line. The Tessa Tee compliments trousers, capris and skirts of all cuts. (4B5)Features- Scoop neck- Rounded hem- Slightly boxy cutBlue Sky fit guide - true to sizeFabric - 95% Bamboo, 5% Lycra"
208,Koy Ladies Miami Smocked Bandeau Top,Not mention,{},Not mention
209,TWIST DROP TEE,drop tee,"{Nu,Psychedelic}","Vibrant all over front &amp; back design100% premium soft-spun polyesterPrint will never fade, crack or wrinkleLong fit with rounded hemlineHandmade with love in North America, just for you!Ships out in 7 - 10 business days."
