,title,product_type,tags,body_html
96,Carry on Unisex Tee in Heather Stone,t-shirt,{clothing},"This unisex tee fits like a well-loved favorite, featuring a crew neck, short sleeves and designed with superior Airlume combed and ring-spun cotton. Heather Stone.Fabrication: 52% Airlume combed and ring-spun cotton, 48% poly, 32 single 4.2 oz.Generous fit for women and an athletic fit for men.Chest to Fit (inches):   XS -  18 1/2, S - 18, M - 20, L - 22, XL - 24Body Length (inches): XS - 27, S - 28, M - 29, L - 30, XL - 31"
97,ALTERED PERSPECTIVE SLEEVELESS HOODIE,premium sleeveless hoodie,"{Galaxy,Nu,Psychedelic,""Sacred Geometry""}","Vibrant all over front, back &amp; hood design100% premium soft-spun polyResistant to wrinkles, shrinking, abrasion and mildewPrint will never fadeHandmade with love in North America, just for you!Ships out in 7 - 10 business days."
98,"Dena Tank, Green Room, Linen Bamboo",tank,"{20,Green,""Linen Bamboo"",sale,ss2020,Sunny,Tank}","DescriptionA gently fitted tank in woven Bamboo/Linen, that offers breathability and stretch. Lightly tapered at the waist and slightly elongated in the body for coverage. Full coverage shoulder straps and darts at bust ensure a proper fit. Pair the Dena with everything from shorts to pants to skirts. Our Linen fabric requires no ironing. Just spritz with water and hang to dry.Features- Scoop neck- Wide shoulder straps- Elongated bodice for coverageBlue Sky fit guide - true to size; go one size up if you're full in the bust.Fabric - 50% Bamboo, 50% Linen"
99,Street Casual Hoodie Jacket,hoodie,"{71114,Dolcezza,F21,hoodie,Jacket,Sweater}","Style # 71114 - 07/0895Dolcezza perfectly blends contemporary elements with a relaxed athleisure style with this hoodie. This comfy piece features a front zipper, drawstring hood, long sleeves and side pockets.Style: Hoodie jacketFit: StandardLength: HipDrawstring hoodFront zipperLong sleevesFront pocketsRhinestone embellishmentsMachine wash on gentle cycleComposition: 70% Cotton, 30% Polyester"
100,The North Face Men’s TKA Glacier Full Zip Jacket Monterey Blue,shirts,"{mens,outerwear}","NF0A4AJCBH7The TKA Glacier Full Zip is a lightweight fleece jacket that is made for layering and from 100%-recycled content, so you can look and feel great, whether you're pushing to the summit or along a crowded sidewalk.FEATURESStandard fitReverse-coil center front and hand pocket zipsEmbroidered logo on left chest100-weight, 100% post-consumer recycled classic fleeceElastic-bound cuffs and hem"
101,"Tara Blouse, Blue Carnation",blouse,"{20,""3/4 Sleeve"",Blouse,Linen,""Linen Bamboo"",sale,ss2019,sunny,""Tent Sale 0219"",tentsale,White,womensale}","DescriptionOur Tara blouse offers timelessly tailored style in cool-wear Bamboo/Linen. Traditional shirt in shoulders and placket, the Tara has a suggestion of tunic ease in length and mid-section ease. A small straight collar offers coverage, with a small V-neckline. Crisp, and easy to wear over capri pants or leggings. (4B3)Features- Tunic length- Small collar with buttons- V-necklineBlue Sky fit guide - true to size.Fabric - 50% Bamboo, 50% Linen<!--.tb_button {padding:1px;cursor:pointer;border-right: 1px solid #8b8b8b;border-left: 1px solid #FFF;border-bottom: 1px solid #fff;}.tb_button.hover {borer:2px outset #def; background-color: #f8f8f8 !important;}.ws_toolbar {z-index:100000} .ws_toolbar .ws_tb_btn {cursor:pointer;border:1px solid #555;padding:3px}   .tb_highlight{background-color:yellow} .tb_hide {visibility:hidden} .ws_toolbar img {padding:2px;margin:0px}--><!--.tb_button {padding:1px;cursor:pointer;border-right: 1px solid #8b8b8b;border-left: 1px solid #FFF;border-bottom: 1px solid #fff;}.tb_button.hover {borer:2px outset #def; background-color: #f8f8f8 !important;}.ws_toolbar {z-index:100000} .ws_toolbar .ws_tb_btn {cursor:pointer;border:1px solid #555;padding:3px}   .tb_highlight{background-color:yellow} .tb_hide {visibility:hidden} .ws_toolbar img {padding:2px;margin:0px}-->"
102,"Kim Cap, Sage, Bamboo",top,"{20,Bamboo,Green,sale,SS2019,Sunny,Top}","DescriptionThe Kim Cap has just the right touch of femininity, balanced with extra room in all the right places. Soft, stretchy Bamboo fabric makes for a fitted bodice that is flattering and comfy. Below the bodice, an empire seam with a dropped point at centre-front, which creates a vertical line to elongate the body. Fabric flares out from the empire seam to provide coverage and a touch of elegance. Sophisticated and simple, the Kim looks great with slim pants and skirts.Features- Deep, scoop neckline- Fitted bodice- Empire seam with fit and flare shapeBlue Sky fit guide - true to sizeFabric - 95% Bamboo, 5% Lycra"
103,DEXTOR KNIT - BLACK,sweater,"{black,dexter,knit,mens,pullover,""spring 22"",sweaters}",Men's long sleeve Pullover perfect for casual outfits paired with jeans. - Detail Type : Pullover - Fabric : Structured knit - Length/size : Regular - NECK : O-Neck - SLEEVE : Long Sleeves (L/S)
104,"Kathy Jacket, Violet, Bamboo",jacket,"{Bamboo,basic,Jacket,regular,Sunny,Violet,""Violet Zone""}","DescriptionThe Kathy is a great layering piece. An open jacket, it is fitted through the arms. Falling from the shoulder, it tapers at the waist and flares slightly around the hip. The front panels add movement coverage. The subtle shaping flatters the body, and allows flow. The Kathy Jacket works well with sleeveless tops or dresses, and a wide variety of bottoms.Features- 3/4 length sleeves- Open style- Flares slightly around the waistBlue Sky fit guide - true to sizeFabric - 95% Bamboo, 5% Lycra"
105,Dots Long Jacket,jacket,"{11283,EVERSASSY,F21,Jacket}","Style # 11283 - 07/0872This lovely jacket is the missing piece in your wardrobe. It is great for keeping you warm on chilly days (and from the office air-conditioning), while still looking polished and professional. We love the longer silhouette, large collar and large pockets on the front. Whether your style is more causal or more edgy, the silhouette is figure flattering and easy to style with other pieces in your wardrobe.Style: Light jacketFit: Slightly wideLength: Above the kneeLarge collarFront buttonsLong sleeves with black cuffsLarge elastic front pocketsMachine wash in cold waterComposition: 100% Polyester"
106,"Mariah Top, Royale, Bamboo",top,"{50%,Basic,""Long Sleeve"",new,Purple,sale,Top}","DescriptionThe Mariah gives you a simple, long-sleeve shirt style with exceptional stretch and comfort. A high, round neckline and full-length sleeves provide a sleek finish across the body. The hemline is slightly rounded and hits right at the hip. Ideal for layering under vests, jackets, and coats. Our Bamboo/Modal blend is light and breathable, ensuring you won't overheat.Features- High, round neckline- Long sleeves- Slightly rounded hemlineBlue Sky fit guide - true to size.Fabric - 50% Bamboo 42% Modal 8% Lycra"
107,Button Up Gloria Blouse / Indigo,tops,"{Blouses,""Button Ups"",groupbycolor,Shelter,Tops}","Made with beautiful Indigo linen, this top has long puffed sleeves and delicate cuff at the wrist. This collared button up style features U-shaped hem and pleating detail at the back.Details:100% LinenMade in Canada  Lola is 5'7"", bust: 34"" waist: 26"" hips: 35"", wearing a size S "
108,MYSTIC HOODIE,premium hoodie,"{Galaxy,Nu,Psychedelic,""Sacred Geometry"",Space}","Vibrant all over front &amp; back design100% premium soft-spun polyesterPrint will never fade, crack or wrinkleHandmade with love in North America, just for you!Ships out in 7 - 10 business days."
109,Beach Bound Tank,tops,"{_tab1_atb-b,_tab2_s-c,_tab_4_s-e,blouse,clothing,""free people"",pink,sale,tops}",Lightweight and super soft textured tank featuring a plunging V-neckline.Adjustable waist tieSmocked detailing65% Polyester30% Rayon5% Spandex
110,Nike SB x Carpet Company Hoodie (U.S Release only),tops,"{Baltimore,black,blue,carpet,company,exclusive,habibis,hood,hoodie,maryland,""Mens Clothing"",new,""Nike SB"",QS,skate,skateboarding,swoosh,u.s,yellow}","Nike SB x Carpet Company Skate Hoodie in Black and Speed Yellow.This relaxed fitting Nike SB hoodie arrives as part of the brand’s recent collaboration with Baltimore-based Carpet Company.Heavyweight in construction and designed to provide ample insulative coverage to any demanding setting, this non-invasive hooded sweater features cuffed sleeves, a thick-rib elasticated hemline and colour-matched drawcord trims across its deep-set hooded neckline. A dual-entry kangaroo pocket can be found above the waist, whilst the mixed-material fabric ‘Carpet SB’ Swooshed central chest decal plays homage to its namesake and a white-fabric Arabic translation of ‘Nike’ beneath the hood and an embroidered C-star emblem above the right-cuff helps seal this worn-wash hoodie off with an added sense of textural depth.With an endearing appreciation for Baker Skateboards and inspired by their Egyptian heritage, brothers Ayman and Osama Abdeldayem pair with Nike SB to welcome the timely arrival of their latest Carpet Company collection. Based out of Maryland in Baltimore and famed for their innovative approach to cross-cultural aesthetics, Carpet Company is an out-the-box brand with a playfully unique undertone to match.Material: formulated blend of 84% cotton and 16% polyesterMade in China"
111,Heavy Weight Hoodie,hoodies,"{Hoodies,Mountain}",A Canadian Classic. *FREE shipping on orders over $115*Our cozy heavy weight hoodie (Bunny Hug) is great for evening walks or weekend camping trips. It's true-to-size and complete with a fleece lining. Go up a size if you are wanting some extra cozy vibes.True to size. Check sizing chart for reference.
112,ABSTRACT GLITCH SWEATSHIRT,premium sweatshirt,"{Nu,Psychedelic}","Vibrant all over front &amp; back design100% premium soft-spun polyesterPrint will never fade, crack or wrinkleLight fleece inner liningHandmade with love in North America, just for you!Ships out in 7 - 10 business days."
113,"Matt Jacket, Black, Bamboo Fleece",jacket,"{""Bamboo Fleece"",basic,Black,Jacket,Men,regular,Sunny}","Practical layering jacket in soft, breathable bamboo fleece that offers full-coverage and warmth.Blue Sky fit guide - true to sizeFabric - 67% Bamboo, 28% Cotton, 5% Lycra<!--.tb_button {padding:1px;cursor:pointer;border-right: 1px solid #8b8b8b;border-left: 1px solid #FFF;border-bottom: 1px solid #fff;}.tb_button.hover {borer:2px outset #def; background-color: #f8f8f8 !important;}.ws_toolbar {z-index:100000} .ws_toolbar .ws_tb_btn {cursor:pointer;border:1px solid #555;padding:3px}   .tb_highlight{background-color:yellow} .tb_hide {visibility:hidden} .ws_toolbar img {padding:2px;margin:0px}-->"
114,HEADLINER HOODIE,premium hoodie,{},"Vibrant all over front &amp; back design100% premium soft-spun polyesterPrint will never fade, crack or wrinkleHandmade with love in North America, just for you!Ships out in 7 - 10 business days."
115,RIVER UFO ABDUCTION HOODIE,premium hoodie,"{Nu,Psychedelic}","Vibrant all over front &amp; back design100% premium soft-spun polyesterPrint will never fade, crack or wrinkleHandmade with love in North America, just for you!Ships out in 7 - 10 business days."
116,Top - Free People Always Yours Tee,womens top,"{08Apr22,always,cornflower,dried,free,""new arrival"",people,pine,tee,top,womens,yours}","Free People always yours teeYour new go-to tee featured in a classic V-neck silhouette with capped sleeves and exposed seaming throughout for a true lived-in look.52% Cotton, 48% Polyester"
117,"Ramona Sweater, Snow Leopard, Bamboo Cotton",sweater,"{""Bamboo Cotton"",fw2021,""Grey Zone"",Marie,regular,Sunny,Sweater,White}","Fabric: 50% Bamboo, 50% Cotton"
118,OUTLOOK T,premium tee,"{Galaxy,Nu,Psychedelic,""Sacred Geometry""}","Vibrant all over front &amp; back design100% premium soft-spun polyesterPrint will never fade, crack or wrinkleHandmade with love in North America, just for you!Ships out in 7 - 10 business days."
119,Linen Polo Top / Toasted,tops,"{Cordera,groupbycolor,""Knit Top"",Knitwear,""Monica Cordera"",Tops,unisex}","V-polo collar sweater with short sleeves and ribbed details. Made with a light and cool linen blend knit.Details: 50% linen 50% lyocellMade in Spain Lola is 5'7"", bust: 34"" waist: 26"" hips: 35"" wearing a size O/S About the brand:Cordera is about contemporary and minimal designs holding hands with an ethical and sustainable production, 100% made in Spain. Founded in 2008 by two sisters, Mónica and María, the brand strives to create timeless wardrobes curated with pure and minimal designs. The brand is based in Galicia, where all the garments are ethically and carefully created and crafted. "
120,"Jazz Tank, Magenta, Bamboo",tank,"{20,Bamboo,Red,sale,Sunny,Tank}","DescriptionOur best-selling tank, the Jazz provides comfort through it's design and our soft, Bamboo fabric.The fuller shape of the Jazz Tank is both forgiving and style-ready. Designed so that fabric floats away from the body, creating a softened visual effect and clean finish. A longer hemline in the back provides coverage, and shoulder straps are carefully shaped to hide bras.Features- U-neckline- Wide shoulder straps- A-line shape- Shirt-tail hemlineBlue Sky fit guide - generousFabric - 95% Bamboo, 5% LycraLength Measurements, Top of Shoulder to Bottom of Hemline (cm)XXSXSSMLXL1X2X3X4X65676971737577808284"
121,Long Sleeve Ruched Top,top,"{Blouse,EVERSASSY,F21,TOP}","Style # 10807 – 03/0816You’ll be a style icon in this lovely ruched top. Featuring a memory collar neckline, gathered drawstring front and long sleeves with ruching and drawstrings, this piece will add a unique and edgy look to your wardrobe. Style: TopFit: StandardLength: HipMemory collarGathered drawstring frontLong sleeves with ruching and drawstringsHand wash in cold waterComposition: 100% Polyester"
122,"Eric Sweater, Black, 100% Merino Wool",sweater,"{fw2021,Men,regular,Sweater,Wool}",Fabric: 100% Merino Wool
123,Blouse with Camel Trim,blouse,"{Blouse,Dolcezza}","Style # 70114 – 03/06C0Upgrade your wardrobe basics with a touch of style and comfort. This long sleeve blouse features a classic style, long sleeves and iridescent front buttons. The camel trim is unique and timeless. Showcase your individual; style by styling this top with vibrant coloured pants or tucking it into your favourite dark jeans.Style: BlouseFit: StandardLength: HipLong sleevesClassic collarFront buttonsHand wash in cold waterComposition: 96% Cotton, 4% Elastane"
124,Lounge Crew / Natural,tops,"{""bare knitwear"",groupbycolor,Knitwear,Tops}","""Designed for year around wear, The Lounge Crew is our all-season pullover. Both breathable and cozy, this medium weight pima cotton crew breathes during the warmer months and keeps you cozy throughout the winter. The simple design and easy to wear shape make the Lounge Crew an easy staple to pull on with anything in your wardrobe and wear on repeat. Matches with the Lounge Pant.""Details:Ethically made in Lima, PeruPairs beautifully with the matching Lounge Pant100% Oeko-Tex Certified Peruvian Pima Cotton.Pre-washed for shrinkageWill relax with wear and re-shape in the washMachine wash separately on a delicate cycle in cold water using a mild soapRe-shape and lay flat to dry on a clean surfaceIf hand washed, use a mild detergent in cool water and lay flat to dry on a towel. Avoid hanging, stretching or ringing out when garment is wet.Jean is 5'2, size 0, wearing XS/S"
125,TONGUE TWISTER HOODIE,premium hoodie,{},"Vibrant all over front &amp; back design100% premium soft-spun polyesterPrint will never fade, crack or wrinkleHandmade with love in North America, just for you!Ships out in 7 - 10 business days."
126,Top - Free People Leilani Pullover,womens top,"{02Feb22,combo,cupcake,free,leilani,""new arrival"",people,pullover,top,womens}","Free People Leilani pulloverThe definition of a goes-with-anything essential, this timeless pullover is featured in an oversized, slouchy fit and soft textured knit fabrication with a confetti color printing throughout for added dimension.Wide scoop necklineDropped shouldersExaggerated sleeves"
127,RAVETIVITY T,premium tee,"{Nu,Psychedelic}","Vibrant all over front &amp; back design100% premium soft-spun polyesterPrint will never fade, crack or wrinkleHandmade with love in North America, just for you!Ships out in 7 - 10 business days."
128,TRIPPY DYE GLITCH HOODIE,premium hoodie,{},"Vibrant all over front &amp; back design100% premium soft-spun polyesterPrint will never fade, crack or wrinkleHandmade with love in North America, just for you!Ships out in 7 - 10 business days."
129,"Peachy Tank, Ice Diamonds",tank,"{Blue,Nyoman,Rayon,regular,Tank,Viscose}","DescriptionThe Peachy is light and flowy - the ideal Summer tank! We've gathered the fabric above the bust to create a swinging arc around the body, offering easy cool wear and coverage. A wide neckline frames the face but covers bra straps, and multiple pleats mean the top sits easily on the body. Two front inset pockets add a touch of fun and utility to the tank. The hemline is long enough, falling where you need it, but short enough to not overwhelm the wearer. The result: great proportions that work with all types of bottoms.Features- Wide shoulder straps- Two inset pockets- Multiple for easy wearBlue Sky fit guide - true to size, generous around the bust.Fabric - 100% Plant-based, Wrinkle-resistant Viscose"
130,Cotopaxi Women's Paseo Travel T-Shirt Terracotta,shirts,"{Cotopaxi,shirts,sportswear,tops,womens}","PASE-S21-TERR-WA super soft, odor-resistant t-shirt that works as the perfect base for mix-and-match outfits on the road, the Paseo features a flattering v-neck cut and boasts a longer, more elegant length. Side venting boosts the tee’s breathability, and a Polygiene® anti-odor finish keeps the Paseo smelling and feeling fresh between washes. Made from a quick-drying blend of 80% recycled polyester and 20% TENCEL™, the Paseo keeps you feeling comfy on day trips, waterfall hikes, plane rides, and everything in between.FeaturesQuick dryV-neckLonger length with side ventingSpecs80% recycled polyester/20% TENCEL™Polygiene® anti-odor finish"
131,Johnny Cash Martin Guitar Tour Tee,tops,"{_tab1_daydreamer-sizing,_tab2_atb-daydreamer,_tab3_care-daydreamer,blouse,clothing,daydreamer,tops,white}","In the early 70s, Martin Guitar was asked to design an all black lacquered D-35 fit for the “Man in Black.” Cash and his well-known guitar went on to jam on stage for the next 20 years. Now, a wildly popular commodity with newly released renditions of the guitar, the Johnny Cash Martin Guitar Tour Tee takes a country spin on Cash’s famous tool of the trade featuring red flocking and a classic vintage blindstitch."
132,Top - Dex Mixed Marl Cardigan Sweater,womens top,"{1927251,27Jan22,cardigan,dex,marl,mixed,""new arrival"",rainbow,sweater,top,womens}",Dex mixed marl cardigan sweaterAcrylic
133,Two Tie For You Brami,tops,"{_tab1_free-people-sizing,_tab2_atb-free-people,_tab3_care-free-people,blouse,clothing,free-people,tops}",Ultra cute brami featuring a front tie design with button closures.100% Polyester
134,DEEP TABOO MERKABA HOODIE,premium hoodie,"{Dark,Nu,Psychedelic,""Sacred Geometry""}","Vibrant all over front &amp; back design100% premium soft-spun polyesterPrint will never fade, crack or wrinkleHandmade with love in North America, just for you!Ships out in 7 - 10 business days."
135,YANTRA SLEEVELESS HOODIE,premium sleeveless hoodie,"{Psychedelic,""Sacred Geometry""}","Vibrant all over front, back &amp; hood design100% premium soft-spun polyResistant to wrinkles, shrinking, abrasion and mildewPrint will never fadeHandmade with love in North America, just for you!Ships out in 7 - 10 business days."
136,Brooks Men's Distance Graphic Short Sleeve Indigo Rush Altitude Print,shirts,"{brooks,mens,shirts,sportswear,tops}","211320406Super soft, quick-drying fabric plus bright style equals a performance running T-shirt that can carry you through the rest of your day.BEST FOR…All day wearLayeringSeasonal graphicsFEATURESModern fitQuick dryingSustainably madeSPECSSemi-fittedUPGRADED CLASSICModern FitThe updated design features ribbing around the neckline to prevent the fabric from stretching out.HARD RUN? NO SWEAT.Quick dryingThe sweat-wicking, quick-drying fabric keeps you comfortable during your workout.EARTH-FRIENDLY DESIGNSustainably madeThis top just keeps getting better. It’s made from 88% recycled materials for lighter environmental impact.Made with recycled fabric equal to eleven plastic water bottles."
137,Candy Jacket,blazer,"{Blazer,Dolcezza,Jacket}","Style # 20201 – 07/07B3This unique jacket is great for layering and features a lapel collar design, a blazer style and long sleeves. Simple and refined, this jacket strikes the right balance between comfort and style.Style: BlazerFit: StandardLapel collar with rhinestonesFront zipperFront pocketsLong sleevesHand wash in cold waterComposition: 95% Cotton, 5% Elastane"
138,"Winlaw Sweater, Black, Cashmere",sweater,"{Black,Cardigan,Cashmere,""Charcoal Zone"",fw2021,regular,Sweater,Wool}","DescriptionYour favourite classic cardigan style is now available in luxurious Cashmere. The Winlaw Sweater has a slightly boxy fit, with button closures that create a V-neckline. Small slits on either side of the hip ensure no stretching or pulling. The Winlaw is warm enough to wear on its own but thin enough for layering too.Features- Button closure- Ribbing at cuffs and waistBlue Sky fit guide - true to size.Fabric: 90% Wool, 10% Cashmere<!--.tb_button {padding:1px;cursor:pointer;border-right: 1px solid #8b8b8b;border-left: 1px solid #FFF;border-bottom: 1px solid #fff;}.tb_button.hover {borer:2px outset #def; background-color: #f8f8f8 !important;}.ws_toolbar {z-index:100000} .ws_toolbar .ws_tb_btn {cursor:pointer;border:1px solid #555;padding:3px}   .tb_highlight{background-color:yellow} .tb_hide {visibility:hidden} .ws_toolbar img {padding:2px;margin:0px}-->"
139,LINE ELowen Knit Tank in Blue Topaz,blouses and tops,"{Blouse,LINE,""LINE THE LABEL"",Top,Women's}",The ELOWEN knit tank is crafted from a lightweight recycled cotton blended yarn and features a slim fit and flattering high neckline.73% RECYCLED COTTON 19% ACRYLIC 3% NYLONDry CleanModel is 5'9 and is wearing a size Small
140,Nike Men's Nike Dri-FIT Miler Running Top Sangria,shirts,"{mens,nike,shirts,sportswear,tops}","CU5992-610LIGHT AND MOBILE.Take on your daily route with the Nike Dri-FIT Miler Top. It features lightweight performance and mobility for the entry-level runner. This product is made with at least 50% recycled polyester fibers.Ventilated FlowAll-new materials made of crimped yarn create airflow to help keep you cool. The soft feel helps cuts down on chafing during your runs.Keep It MovingThe seams at the shoulders are rolled back to help your arms move freely. A curved hem extends coverage in the back while hem vents keep you mobile.Dri-FIT technology helps you stay dry, comfortable and focused. More Details Standard fit for a relaxed, easy feelLow-profile back neck tape“NIKE RUNNING” on neck tapeReflective elements100% polyesterMachine washImportedNot intended for use as Personal Protective Equipment (PPE)100% POLYESTER"
141,THE VOID V2 HOODIE,premium hoodie,{},"Vibrant all over front &amp; back design100% premium soft-spun polyesterPrint will never fade, crack or wrinkleHandmade with love in North America, just for you!Ships out in 7 - 10 business days."
142,NEON MANDALA SWEATSHIRT,premium sweatshirt,"{Galaxy,Nu,Psychedelic,Space}","Vibrant all over front &amp; back design100% premium soft-spun polyesterPrint will never fade, crack or wrinkleLight fleece inner liningHandmade with love in North America, just for you!Ships out in 7 - 10 business days."
143,"Jazz Tank, Teal, Bamboo",tank,"{Bamboo,basic,basic2022,regular,Sunny,Tank,Teal}","DescriptionOur best-selling tank, the Jazz provides comfort through it's design and our soft, Bamboo fabric.The fuller shape of the Jazz Tank is both forgiving and style-ready. Designed so that fabric floats away from the body, creating a softened visual effect and clean finish. A longer hemline in the back provides coverage, and shoulder straps are carefully shaped to hide bras.Features- U-neckline- Wide shoulder straps- A-line shape- Shirt-tail hemlineBlue Sky fit guide - generousFabric - 95% Bamboo, 5% LycraKyla is 5' 6"" and wears size XS.Length Measurements, Top of Shoulder to Bottom of Hemline (cm)XXSXSSMLXL1X2X3X4X65676971737577808284"
144,SHROOMZ SWEATSHIRT,premium sweatshirt,"{Narcotics,Nu,Psychedelic}","Vibrant all over front &amp; back design100% premium soft-spun polyesterPrint will never fade, crack or wrinkleLight fleece inner liningHandmade with love in North America, just for you!Ships out in 7 - 10 business days."
145,Original Oui Tee / Iris,tops,"{""Clare V."",groupbycolor,Tops}","Meet the extra soft Original Oui Tee. Sitting at the waist, it pairs perfectly with your favourite jeans. Details:100% cottonPreshrunkMade in Los Angeles, CaliforniaKatelyn is 5'6"", size 2/4 wearing a size S About the brand:After noticing a lack of functional yet stylish laptop cases while working as a journalist for French TV, Clare decided to create her own line of handbags and accessories. Over time, Clare’s been able to cultivate an identifiable aesthetic that's all her own and has been recognized worldwide by influencers, tastemakers, celebrities and bloggers, who support and wear the line. Clare’s strong connection to France, where she spends a significant amount of time each year with her French husband and son, remains at the core of the brand, with signature elements visible within every collection."
